462,ILS,PT. INTI LINGGA SUKSES,Komp. Mega Grosir Cempaka Mas Blok A No. 20. Jl Raya Let. Jend. Soeprapto Jakpus,30,1,NULL,NULL,0,1,NULL,NULL,NULL,(021) 42876828,(021) 42876654,Ibu Dessy Linorah,0,NULL,NULL,NULL,3020004732,10,KUNINGAN,PT. INTI LINGGA SUKSES,0
463,HTI,PT. HONDA TRADING INDONESIA,MidPlaza 1, 6th Floor. Jl. Jend. Sudirman Kav. 10-11 Jakarta. 10220,30,1,NULL,esunarya@hti.co.id,NULL,1,NULL,NULL,NULL,021-57907022,021-57907033,Bp. Edwin,0,NULL,NULL,NULL,665147228,4,JAKARTA,PT. HONDA TRADING INDONESIA,0
464,NSP,PT. NAWA SETIA PERKASA,Kp. Kalijurung RT 01 RW 03 Kel. Purawasari Kec. Purawasari Karawang Jawa Barat,0,0,NULL,Nawasetiaperkasa_2012@yahoo.co.id,NULL,1,NULL,NULL,NULL,0264 8388689,NULL,NULL,0,NULL,NULL,NULL,011601000730305,5,Karawang,PT. NAWA SETIA PERKASA,0
465,HKM - FKM,PT. FAJAR KUMALA MOTOR  ( Honda Kumala Karawang ),Jl. Arteri Interchange Tol Karawang Barat   Karawang - Indonesia,0,0,NULL,NULL,NULL,1,NULL,NULL,NULL,+62267 8453388 || +6281318093898,+62267 8454743,Bpk Yogie Abiyoga,0,NULL,NULL,NULL,1219989268,16,KARAWANG,PT. FAJAR KUMALA MOTOR,0
466,CAA,PT. CITRA AIRINDO ABADI,Jl Kemanggisan Utama Raya No. 50A,30,1,NULL,NULL,0,1,NULL,NULL,NULL,(021) 5366 5577,(021) 5366 5578,Ibu Yunita,0,NULL,NULL,NULL,1650000441031,12,GREEN VILLE,PT. CITRA AIRINDO ABADI,0
467,AJM,PT.ASRI JAYA MANDIRI,JL.CARINGIN RAYA MAKRIK I NO 88 RT 002 RW 005 , RAWA LUMBU. BEKASI,JAWA BARAT,INDONESIA,NULL,1,31.407.666.2-432.000,NULL,1,NULL,NULL,NULL,NULL,NULL,NULL,NULL,0,NULL,NULL,NULL,NULL,NULL,NULL,NULL,0
468,MSS,PT. MULTI SARANA SERVITIANUSA,Jl Cempaka 7 Blok C5 No. 23 Taman Modern - Cakung - Jakarta Timur,NULL,1,NULL,putugp@yahoo.co.id,NULL,1,NULL,NULL,NULL,NULL,NULL,NULL,0,NULL,NULL,NULL,NULL,NULL,NULL,NULL,0
469,PJL,PT.PLATINUM JAYA LOGISTIC,Komplek Sentra Bisnis - JL.Harapan Indah Raya SS.3 NO.2 RT.RW KEL.Medan Satria KEC.Medan Satria Kota Bekasi, JAWA BARAT,NULL,1,70.845.659.5-407.000,NULL,1,NULL,NULL,NULL,NULL,NULL,NULL,NULL,0,NULL,NULL,NULL,NULL,NULL,NULL,NULL,0
470,RT,TOKO RANAYA TEHNIK,Puri Sentosa Blok D11 No. 42 Cikarang Pusat 17530,10,0,NULL,NULL,0,1,NULL,NULL,NULL,(021) 92368871,081511238111,Bpk Tri,0,NULL,NULL,NULL,NULL,NULL,NULL,NULL,0
471,MSS,PT. MULTI SARANA SERVITIANUSA,Jl Cempaka 7 Blok C5 No. 23 Taman Modern - Cakung Jakarta Timur,14,1,NULL,NULL,0,1,NULL,NULL,NULL,(021) 4610920,(021) 4607514,Bpk. Putu Gede Parwata,0,NULL,NULL,NULL,1250001125632,12,PULO GADUNG,PT. MULTI SARANA SERVITIANUSA,0
472,KAMAN,CV. KARYA MANDIRI,Perum Griya Asri 2 Blok E1 No. 7 Sumber Jaya, Tambun Selatan - Bekasi,30,1,NULL,NULL,0,1,NULL,NULL,NULL,(021) 8836 0016/08128367892,(021) 8836 0016,Bpk. Mustiko Wibowo,0,NULL,NULL,NULL,1560005749744,12,TAMBUN,CV. KARYA MANDIRI,0
473,AI - KRW,PT. Astra International,Jl. Galuh Mas Raya  Kav.CBD Blok 5 No.1D  Teluk Jambe Timur - Karawang 41314,14,0,01.302.584.6-092.000,NULL,0,1,NULL,NULL,NULL,+62267 8636363,+62267 8637550,Bpk Ahmad Sarnubih,0,NULL,NULL,NULL,0933023033,1,KARAWANG,PT. ASTRA INTERNATIONAL,0
474,VGM,PT. VISINDO GUNA MANDIRI,Jl.. Taman Malaka Selatan  Blok B2 No.45  Kel. Malaka Sari  Kec. Duren Sawit - Jakarta,30,1,NULL,pt_visindogunamandiri@yahoo.com,0,1,NULL,NULL,NULL,+6221 33608858,+6221 29091407,Mr Arie Wibawa,0,NULL,NULL,NULL,207201000015305,5,SENTRA NIAGA KALIMAS,PT. VISINDO GUNA MANDIRI,0
475,HEJ,PT. HIMALAYA EVEREST JAYA,Jl Sriwijaya Kav. 10 Lippo Cikarang, Bekasi 17550,30,1,NULL,hejbks@centrin.net.id,0,1,NULL,NULL,NULL,021 8990 4073,021 8990 4075,Bpk. Ujang Hasan,0,NULL,NULL,NULL,1180007567968,12,DAAN MOGOT,PT. HIMALAYA EVEREST JAYA,0
476,SJMI,PT. SUKSES JAYA MAKMUR INDONESIA,Jl Siliwangi KM 3.1 Komplek Pamis No. C-5 Kel. Gembor Pasar Kemis, Tn,30,1,NULL,marketing_sjmi@yahoo.com,NULL,1,NULL,NULL,NULL,021 590 1390,021 590 5139,Bpk. Suparman,0,NULL,NULL,NULL,NULL,NULL,NULL,NULL,0
477,FRJ,CV. FRADISIL JAYA,Jl. Mawar II No. 28-29 Cikahuripan Neglasari - Tanggerang,14,0,NULL,NULL,0,1,NULL,NULL,NULL,021 553 8704 / 0816984817,021 7059 9910,Bpk Yaddy Suciady,0,NULL,NULL,NULL,NULL,NULL,NULL,NULL,0
478,TINNO,CV. TINNO WIJAYA,Jl Perjuangan Gg. Cempedak No. 68 RT 007 RW 002 Teluk Pucung - Bekasi Utara,30,1,NULL,NULL,0,1,NULL,NULL,NULL,021 2961 6737,021 9764 7182,Bpk. Firman,0,NULL,NULL,NULL,0663055507,1,BEKASI,CV. TINNO WIJAYA,0
479,MTI,PT. MEGA TAMA INDONESIA,Kawasan Industri Jababeka II, Ruko Sunter Niaga Blok F No. 9 Cikarang - Bekasi,30,1,NULL,NULL,0,1,NULL,NULL,NULL,021 2908 2565,021 2908 2566,Bpk Rusianto,0,NULL,NULL,NULL,NULL,NULL,NULL,NULL,0
480,FASTEC,PT. FASTEC,Jl. Raden Saleh No. 72 B - Cileduk Tangerang - Indonesia,NULL,1,NULL,NULL,1,1,NULL,NULL,NULL,021 73454341,021 73454342,NULL,0,NULL,NULL,NULL,1550001310047,12,JAKARTA,PT. FASTEC,0
481,BPP,PT.BESTINDO PUTRA PERKASA,JL.LOGISTIK NO 59 RT 004/004 TUGU SELATAN KOTA JAKARTA UTARA,NULL,1,02.187.672.7-045.000,NULL,1,NULL,NULL,NULL,NULL,NULL,NULL,NULL,0,NULL,NULL,NULL,NULL,NULL,NULL,NULL,0
482,FKM,PT. Fajar Kumala Motor,Jl. Arteri Interchange Tol Karawang Barat,0,0,NULL,NULL,0,1,NULL,NULL,NULL,0267 8453388,NULL,Mr. Joe Meris Sihombing,0,NULL,NULL,NULL,NULL,NULL,NULL,NULL,0
483,MP,PT. MEDIA PNEUMATIC,Rukan Green Garden Blok Z2 No 53, Jl. Dan Mogot KM 3, Jakarta Barat,30,1,NULL,NULL,NULL,1,NULL,NULL,NULL,021-58358691,021-5838692,Bpk. Margo,0,NULL,NULL,NULL,0701243366,16,GREEN MANSION,PT. MEDIA PNEUMATIC,0
484,MercureHotel,MERCURE Hotel Karawang,Jl. Galuh Mas Raya, Teluk Jambe Karawang Barat,14,0,NULL,Sales@mercure-karawang.com,0,1,NULL,NULL,NULL,+62267 8638888,+62267 8638000,Mr Zikri,0,NULL,NULL,NULL,1093030072,1,Karawang,PT. KARAWANG CITY DEVELOPMENT,0
485,STS,CV. SAMUDERA TEKNIKINDO SELARAS,Jl. Tarum Barat, Ruko Pasar Bersih Blok B-7 Jababeka II, Cikarang - Bekasi,30,1,NULL,samuderateknikindo@yahoo.com,0,1,NULL,NULL,NULL,021 3647 0560/62,021 2945 3701,Bpk Edi Eston,0,NULL,NULL,NULL,NULL,NULL,NULL,NULL,0
486,SAB,PT.SUMMIT AUTO BODY INDUSTRY CO., LTD (BRANCH 2),61 Moo 9 Rojana Industrial park Zone 2 Khanham, U-Thai, Ayutthaya 13210  ( TEL. : +66-35-746-521, FAX : +66-35-746-530 ),NULL,1,00.000.000.0-000.000,NULL,1,NULL,NULL,NULL,NULL,NULL,NULL,NULL,0,NULL,NULL,NULL,NULL,NULL,NULL,NULL,0
487,ATMI,PT. ATMI Cikarang,Jl. Kampus Hijau No. 3 Jababeka Education Park, Cikarang Baru,NULL,1,NULL,NULL,0,1,NULL,NULL,NULL,021 8910 6413 ext. 405,021 8910 8779,Bpk. Hendro,0,NULL,NULL,NULL,0943880333,1,RAWAMANGUN,PT. ATMI CIKARANG,0
488,SII,PT. SINERGI INTI INDUSTRI,JL. Lapangan Bola No 81 Rt 001/03 Kelurahan Sumurbatu Bantar Gebang - Bekasi 17154,NULL,1,03.080.427.2-432.000,NULL,1,NULL,NULL,NULL,NULL,NULL,NULL,NULL,0,NULL,NULL,NULL,NULL,NULL,NULL,NULL,0
489,HYAB,HYAB MAGNETER,Ranhammarsvagen 5, 16867, Bromma, Sweden,0,1,NULL,NULL,0,1,NULL,NULL,NULL,+468-261080,k468-260460,Mr, Daniel,0,NULL,NULL,NULL,NULL,NULL,NULL,NULL,0
490,DAIPLAST,CV. DAIPLAST MANDIRI,Perumahan Taman Jomin Estate Blok C6 No6, Kota bAru, karawang,30,1,NULL,NULL,NULL,1,NULL,NULL,NULL,0264-8386480,0264-8386480,Mr. Supyan,0,NULL,NULL,NULL,NULL,NULL,NULL,NULL,0
491,SAS,CV. SURYA ABADI SEJAHTERA,Ruko Grand Pasadena Blok Q1 No. 7. Jl Tarum Barat 2 Jababeka II - Bekasi 17550,30,1,NULL,saud@suryaabadisejahtera.co.id,0,1,NULL,NULL,NULL,(021) 2908 3104,(021) 8983 0207,Bpk. M. Saud,0,NULL,NULL,NULL,607810003766,18,Jababeka Cikarang,CV. Surya Abadi Sejahtera,0
492,GPP,CV GEMILANG PANCA PRIMA,Perum Gading Elok 1  Blok K 25 No.9  Kel.Karawang Wetan  Kec.Karawang Timur - Jawa Barat,15,0,NULL,gemilangpancaprima@yahoo.co.id,0,1,NULL,NULL,NULL,+6281290004894,+6287741464029,Bpk Bimbi Ardiansyah,0,NULL,NULL,NULL,NULL,NULL,NULL,NULL,0
493,QN,PT. QUIROS NETWORKS,Komp. Business Park Blok D II No. 7 Jl. Raya Meruya Ilir No. 88 Kebon Jeruk - Jakarta Barat 11620,0,1,NULL,NULL,NULL,1,NULL,NULL,NULL,021 30061535,NULL,NULL,0,NULL,NULL,NULL,6560033433,1,KCP BUSINESS PARK,PT. QUIROS NETWORKS,0
494,saan family,SAAN FAMILY,Perum Grand Cikarang City Blok D4 No 7, Cikarang Utara, Bekasi,30,1,NULL,NULL,0,1,NULL,NULL,NULL,081310077617,NULL,Bpk. Yoko,0,NULL,NULL,NULL,NULL,NULL,NULL,NULL,0
495,CAS,PT. CITRAMAS ALFA SEJAHTERA,JL. Jababeka VII Blok K 3A, Jababeka I, Cikarang, bekasi,30,1,NULL,NULL,0,1,NULL,NULL,NULL,021-89834064,021-89834065,Mr. Christianto Purgajaya,0,NULL,NULL,NULL,1948040408,1,JAYAKARTA,PT. CITRAMAS ALFA SEJAHTERA,0
496,PPD,PROGRESS PART AND DIE CO., LTD,1/6 MOO.3 HNAMDEANG MNENG CHCHOENGSAO 24000,NULL,1,0115542002985,NULL,0,1,NULL,NULL,NULL,NULL,038-592-221,Mr. Sayan Somwan,0,NULL,NULL,NULL,NULL,NULL,NULL,NULL,0
497,fadira,CV. FADIRA TEHKNIK,JL. Rya Ciantra RT 008 RW 04, Cikarang Selatan, Bekasi,30,1,NULL,NULL,NULL,1,NULL,NULL,NULL,021-89677367,NULL,Bpk. Andi Hartono,0,NULL,NULL,NULL,1560007873922,12,Cikarang,CV. FADIRA TEKNIK,0
498,SJM,PT. SEBASTIAN JAYA METAL,Jl. Raya Penggilingan Pik Blok D 117-118, Cakung Jakarta Timur,NULL,1,NULL,NULL,NULL,1,NULL,NULL,NULL,021 46826989 / 46823331 - 2,021 4602571,NULL,0,NULL,NULL,NULL,2156377900,2,Matraman,PT. SEBASTIAN JAYA METAL,0
499,SK,PT. SELEKTA KENCANA,Jl. Mitra Sunter Boulevard Blok D/1 Yos Sudarso, Kav. 89 Jakarta - 14350,14,1,NULL,NULL,0,1,NULL,NULL,NULL,021-6530 5268-70,021-6514912,Mrs Clearence Irene,0,NULL,NULL,NULL,NULL,NULL,NULL,NULL,0
500,MPT,PT. MEGA PRATAMA TEKNINDO,Jl. Griya Hijau Raya No. 45, Paku Alam Pusdiklantas - Serpong - Tangerang,NULL,1,NULL,NULL,NULL,1,NULL,NULL,NULL,021 53122709,021 53122749,NULL,0,NULL,NULL,NULL,'1030005417395,12,JAKARTA,PT. MEGA PRATAMA TEKNINDO,0
501,HP,CV. HARAPAN PLASTIK,JL. Karanganyar No. 19 RT 10/06 Kelurahan Tanjung Mekar Karawang Barat - KARAWANG,NULL,1,02.733.396.2-408.000,NULL,1,NULL,NULL,NULL,NULL,NULL,NULL,NULL,0,NULL,NULL,NULL,NULL,NULL,NULL,NULL,0
502,KSM,PT. KENCANA SEJAHTERA MULIA,Jl Bukit Gading Raya Blok A/09 Komplek Rukan Gading Bukit Indah . Kelapa Gading Permai  - Jakarta,30,1,NULL,NULL,0,1,NULL,NULL,NULL,021 451 3619,021 - 451 3620,Bpk.  Selamet Sugiarto,0,NULL,NULL,NULL,NULL,NULL,NULL,NULL,0
503,MA,PT. MATAHARI ABADI,Jl Cipinang Muara III No. 15A-RT 002 RW 015 Jakarta 13420,NULL,1,NULL,NULL,0,1,NULL,NULL,NULL,021 850 1535,021 819 7875,Bpk Johan Tanudjaya,0,NULL,NULL,NULL,NULL,NULL,NULL,NULL,0
504,TPU,PT. TRIM PANDU ENGINEERING,JL. Jababeka XI A, Blok K, No 9B, Jababeka,30,1,NULL,NULL,0,1,NULL,NULL,NULL,021-89845761,NULL,Mr. Sigit,0,NULL,NULL,NULL,NULL,NULL,NULL,NULL,0
505,PJS,PT. PANCA JAYA SAMUDRA,Jln. RE. Martadinata 100 Blok C-12 A, Jakarta 14310 - Indonesia,0,1,NULL,NULL,NULL,1,NULL,NULL,NULL,021 43903117 / 43903118 / 4359511,021 43910434,NULL,0,NULL,NULL,NULL,1200004506510,12,JAKARTA,PT. PANCA JAYA SAMUDRA,0
506,MSI,PT. MITRA SARUTA INDONESIA,Jl Raya Cibarusah No. 32A Sukaresmi Cikarang Selatan Bekasi,30,1,NULL,sales.msicikarang@gmail.com,0,1,NULL,NULL,NULL,021 8967 7277,021 8967 7278,Bpk Hilman,0,NULL,NULL,NULL,6450031958
,1,JAKARTA,PT.MITRA SARUTA INDONESIA
,0
507,SUP,PT. SARANA UNGGUL PRATAMA,Jl. Raya Gaharu Blok F5 No.11 H Delta Silicon II Industrial Park L.C. Cibatu Cikarang Selatan Bekasi Jawa Barat,NULL,1,NULL,NULL,NULL,1,NULL,NULL,NULL,021 89117843,021 89117844,NULL,0,NULL,NULL,NULL,5220800883,1,JAKARTA,PT. SARANA UNGGUL PRATAMA,0
508,GSM,PT. GREAT SUKSES MANDIRI,Delta Silicon park 3, JL. Sungkai Timur Plot F26A, No. 2, Lippo Cikarang,30,1,NULL,NULL,0,1,NULL,NULL,NULL,021-29577672,021-29577676,Ms. Nia,0,NULL,NULL,NULL,7570312698,1,CIKARANG,PT. GREAT SUKSES MANDIRI,0
509,UP,PT. UNILAB PERDANA,Jl. Ciledug Raya No. 10 Cipulir Keb. Lama – Jakarta Selatan 12230,15,0,NULL,sales@unilabperdana.com,0,1,NULL,NULL,NULL,+6221 7253322,+6221 7232723,Mr Fakhri Ramadhan,0,NULL,NULL,NULL,1210096007723,12,JAKARTA,PT. UNILAB PERDANA,0
510,BST,PT. BAROKAH SEJAHTERA TEKNIK,JL. Wibawa Mukti II No. 32, Bekasi,30,1,NULL,NULL,0,1,NULL,NULL,NULL,021-82415194,021-82430035,Mr. Djonny,0,NULL,NULL,NULL,1330011459187,12,JAKARTA,PT. BAROKAH SEJAHTERA TEKNIK,0
511,SOLOTEK,PT SOLO TEKNOLOGI PERKASA,JL GRIYA ASRI II, BLOK D1 NO 80, TAMBUN-BEKASI 17520,30,1,NULL,marketing.solotech@gmail.com,NULL,1,NULL,NULL,NULL,021-29256082,021-29256085,BPK AGUNG,0,NULL,NULL,NULL,NULL,NULL,NULL,NULL,0
512,HKPATI,PT. H-ONE KOGI PRIMA AUTO TECHNOLOGIES INDONESIA,JL. Inspeksi Tarum Barat (Depan Peruri) Desa Parung Mulya, Kecamatan Ciampel, Karawang,30,1,NULL,NULL,0,1,NULL,NULL,NULL,0267-8630555,0267-8630508,Mr Teten,0,NULL,NULL,NULL,NULL,NULL,NULL,NULL,0
513,IWATANI,Iwatani Corporation (Thailand) Ltd.,323 United Center Building. 29th Floor, ROom no.2903. Silom Road, Silom, Bangrak, Bangkok. Thailand,NULL,0,NULL,manit@iwatani.co.th,0,1,NULL,NULL,NULL,66-2-231-1764,66-2-231-1769,Mr. Manit,0,NULL,NULL,NULL,NULL,NULL,NULL,NULL,0
514,DHL,PT. BIROTIKA SEMESTA DHL,Mulia Business Park BLD F, Jl. MT. Haryono Kav. 58-60, Pancoran, Jakarta Sealatan,0,1,NULL,NULL,NULL,1,NULL,NULL,NULL,(021) 79173333,NULL,NULL,0,NULL,NULL,NULL,0700093041890,12,JAKARTA,PT. BIROTIKA SEMESTA DHL,0
515,ciptapandi,PT. CIPTA PANDI,JL. Lapangan Kobra No. 51, Tambun, Bekasi,30,1,NULL,NULL,0,1,NULL,NULL,NULL,021-8825817,021-8374783,NULL,0,NULL,NULL,NULL,8420093218,1,BEKASI,CV. CIPTA PANDI,0
516,SKN,CV. SINAR KARYA NUSA,Jl. Kenanga AK 24 No.10  Pondok Ungu - Bekasi,30,0,NULL,sikanfaz@yahoo.co.id,0,1,NULL,NULL,NULL,+6221 88979219,+6221 88979219,Mr Fauzi  +62818127354,0,NULL,NULL,NULL,NULL,NULL,NULL,NULL,0
517,NULL,%FASTEC,NULL,0,1,NULL,NULL,NULL,1,NULL,NULL,NULL,NULL,NULL,NULL,0,NULL,NULL,NULL,NULL,NULL,NULL,NULL,1
518,OA,PT. OSHA ASIA,Jl. Raya Karanggan No.7  Karanggan Gunung Putri - Bogor 16963  Indonesia,30,0,NULL,yunita@drosha.com,0,1,NULL,NULL,NULL,+6221 7395555 , 87909333,+6221 87909977,Ibu Tri Yunita,0,NULL,NULL,NULL,0004454687,3,JAKARTA,PT. OSHA ASIA,0
519,TSB,PT. TEKAT SUKSES BERSAMA,Perum Permata Hijau Permai Blok F 9 No. 16 RT 007/018 Kaliabang Tengah - Bekasi Utara,30,1,NULL,ariesnasrudin85@gmail.com,0,1,NULL,NULL,NULL,021 9116 8551,021 8778 6442,Bpk. Aries Nasrudin,0,NULL,NULL,NULL,NULL,NULL,NULL,NULL,0
520,AS,CV. ARSANA SENTOSA,Bumi Teluk Jambe  Blok I No.159  Karawang 41361,30,1,NULL,arsana_sentosa@yahoo.co.id,0,1,NULL,NULL,NULL,+62267 640016,+628129848574,Bpk Slamet Sugiarto,0,NULL,NULL,NULL,1320006525191,12,KARAWANG,CV. ARSANA SENTOSA,0
521,MISUMI,PT. MISUMI INDONESIA,JL. Jababeka 5 SFB Blok H/1D, Cikarang Utara,60,1,NULL,NULL,0,1,NULL,NULL,NULL,021-89840008,021-89840007,Mr. Ibnu,0,NULL,NULL,NULL,00915004655,1,JAKARTA,MISUMI INDONESIA,0
522,SOMAGEDE,PT. SOMAGEDE INDONESIA,Ruko Green Village V.1 No 73, JL. Galuh mas Raya, Bumi Teluk Jambe Timur, karawang,30,1,NULL,NULL,0,1,NULL,NULL,NULL,0267-7021672,0267-7021731,Mt. Danar,0,NULL,NULL,NULL,NULL,18,NULL,NULL,0
523,BERLINDO,PT.BERLINDO MITRA UTAMA,Jln. Greenland I Blok AF No.55 Kota Delta  Mas Cikarang Pusat-Bekasi 17530,NULL,1,02.450.101.7-413.000,NULL,1,NULL,NULL,NULL,NULL,NULL,NULL,NULL,0,NULL,NULL,NULL,NULL,NULL,NULL,NULL,0
524,KBL,PT. KARSA BUANA LESTARI,Jl.Kesehatan IV No.45  Bintaro - Jakarta Selatan 12330,0,0,NULL,Lab@karsabuanalestari.com,0,1,NULL,NULL,NULL,+6221 7378020,+6221 73530319,Ibu Hultia Hariani ( +6287763488352 ),0,NULL,NULL,NULL,NULL,NULL,NULL,NULL,0
525,DELTA,PT. DELTA ANUGRAH,Bumi Teluk Jambe Blok J No. 321 Karawang,30,1,NULL,delta.karawang@gmail.com,0,1,NULL,NULL,NULL,(0267) 845 6449,081218678434,Bpk. Budi Miharja,0,NULL,NULL,NULL,NULL,NULL,NULL,NULL,0
526,NULL,%cv,NULL,NULL,1,NULL,NULL,NULL,1,NULL,NULL,NULL,NULL,NULL,NULL,0,NULL,NULL,NULL,NULL,NULL,NULL,NULL,1
527,alvabetha,PT. ALVA BETHA PRESISINDO,Jl. Kemuning N0.8 RT03/RW05, Bojong Menteng, Bekasi,30,1,NULL,NULL,0,1,NULL,NULL,NULL,021-97120194,-,Mr. Bambang,0,NULL,NULL,NULL,0701846060,16,BEKASI,PT. ALVA BETHA PRESISINDO,0
528,EVAGO,PT. EVAGO PRESISI TEKNOLOGI,JL. raya Jababeka - Lemahabang No 23, Cikarang, bekasi,30,1,NULL,NULL,NULL,1,NULL,NULL,NULL,021-89834680,021-898646680,Mr. Ivan,0,NULL,NULL,NULL,NULL,NULL,NULL,NULL,0
529,ASTM,PT. ADYAWINSA SEKISUI TECHNO MOLDING,JL.Angsana Raya Blok L6 No.1 Delta Silicon 1, Lippo Cikarang, Bekasi, Jawa Barat 17550,30,1,NULL,NULL,1,1,NULL,NULL,NULL,+62-21-8990-5317,+62-21-8990-5319,Mr. Eddy Suharja,0,NULL,NULL,NULL,NULL,NULL,NULL,NULL,0
531,NULL,NULL,NULL,NULL,0,NULL,NULL,0,1,NULL,NULL,NULL,NULL,NULL,NULL,0,NULL,NULL,NULL,NULL,NULL,NULL,NULL,1
532,SCS,SUMMIT CHUGOKU SEIRA CO., LTD,Amata Nakorn Industrial Estate, 700/632 Moo 3, Tambol Ban Kao, Amphur Phanthong, Chonburi 20160 Thailand,NULL,0,NULL,ruedee.d@scseira.com,NULL,1,NULL,NULL,NULL,(66 38) 447-077-78,(66 38) 447-099,Ms. Ruedee,0,NULL,NULL,NULL,NULL,NULL,NULL,NULL,0
533,SP,CV SINERGY PRIMA,Graha Cikarang  Blok C8 No.13  Lemah Abang, Cikarang - Bekasi,30,0,NULL,mery@synergi366.com,0,1,NULL,NULL,NULL,+6221 28847227,+6221 37352960,Ibu Merry - 081318054409,0,NULL,NULL,NULL,NULL,NULL,NULL,NULL,0
534,IM,PT. INDOMETAL MITRABUANA,Jl. Angsana Raya  Blok L6  Ds Cibatu  Kec Cikarang Selatan  Kab Bekasi, Jawa Barat - Indonesia  17550,30,0,NULL,kurniadi.dinda@immb.co.id,0,1,NULL,NULL,NULL,NULL,NULL,Bpk Kurniadi Dinda,0,NULL,NULL,NULL,0701550900,16,LIPPO CIKARANG,PT. INDOMETAL MITRABUANA,0
535,DAS,PT. DAME ALAM SEJAHTERA,Jl. Ranggagede Kp. Tanjung Pura Rt.006/008 Kel. Tanjung Mekar Kec. Karawang Barat Karawang - Jawa Barat,NULL,1,00000,NULL,1,NULL,NULL,NULL,NULL,NULL,NULL,NULL,0,NULL,NULL,NULL,NULL,NULL,NULL,NULL,0
536,PANDU,PT. PANDULIMA HYDROMATIC,Jl. Mangga Besar 1 No. 104 A Jakarta Pusat,30,1,NULL,sales.jkt@ptpandulima.com,0,1,NULL,NULL,NULL,021 6286 048,021 6244 615,Bpk Adi,0,NULL,NULL,NULL,1150004740272,12,Jayakarta,PT. PANDULIMA HYDROMATIC,0
537,CTM,PT. CIPTA TOOLSINDO MANDIRI,JL. INSPEKSI KALIMALANG NO. 55, TEGAL DANAS, JAWA MUKTI, CIKARANG PUSAT, BEKASI,30,1,NULL,NULL,0,1,NULL,NULL,NULL,021-29469557,021-29469490,Mr. Yoko,0,NULL,NULL,NULL,NULL,NULL,NULL,NULL,0
538,ACL,PT. ATLANTIC CONTAINER LINI,Jl. Boulevard Bukit Gading Raya Blok D No. 21 Kelapa Gading, Jakarta Utara 14240,NULL,1,NULL,NULL,NULL,1,NULL,NULL,NULL,+621 4509477,NULL,NULL,0,NULL,NULL,NULL,NULL,NULL,NULL,NULL,0
539,NULL,NULL,NULL,NULL,1,NULL,NULL,NULL,1,NULL,NULL,NULL,NULL,NULL,NULL,0,NULL,NULL,NULL,NULL,NULL,NULL,NULL,1
540,NISYI,SINAR NISYI,JL. Sadewa I, no 5 Bantarjati-Bogor,30,0,NULL,NULL,0,1,NULL,NULL,NULL,0251-8344856,0251-8344856,Mr. Yunirza,0,NULL,NULL,NULL,7370179659,1,NULL,YUNIZAR,0
541,CKS,CIPTA KREASINDO STAINLESS,Jl. Industri  Ds Tarikolot  RT 04/08  Citeureup - Bogor  16810,0,0,NULL,ciptakreasi_indo@yahoo.com,0,1,NULL,NULL,NULL,+6221 99883364,+6221 87943643,Bpk Deden Firdaus,0,NULL,NULL,NULL,NULL,NULL,NULL,NULL,0
542,CASH-THAI,CASH - THAILAND,THAILAND,0,0,NULL,NULL,0,1,NULL,NULL,NULL,NULL,NULL,NULL,0,NULL,NULL,NULL,NULL,NULL,NULL,NULL,0
543,QSE,CV. QUEEN SEMESTA ENGINEERING,NULL,30,1,NULL,NULL,0,1,NULL,NULL,NULL,081398164077,NULL,Mr. Agung,0,NULL,NULL,NULL,103800000657,18,CIKARANG,CV. QUEEN SEMESTA ENGINEERING,0
544,GTI,PT. GEOHO TOOLING INDONESIA,JL. Inti II Blok C11 No.18, Kawasan Hyundai Bekasi International Industrial Estate,30,1,NULL,NULL,0,1,NULL,NULL,NULL,021-89905572,021-89905574,Mr. Benny,0,NULL,NULL,NULL,0701714318,16,CIKARANG,PT. GEOHO TOOLING INDONESIA,0
545,AMB,CV. AMB KARYATAMA,Villa Mutiara C 140 Kel Ciantra, Cikarang, Bekasi,30,1,NULL,NULL,0,1,NULL,NULL,NULL,021-96100775,NULL,Mr. Agus,0,NULL,NULL,NULL,NULL,NULL,NULL,NULL,0
546,EKA SEJAHTERA,PT. EKA SEJAHTERA MULIA,Jl Jababeka V Kawasan Industri Jababeka Tahap I Bl U-35/A,0,1,NULL,NULL,0,1,NULL,NULL,NULL,021-8935445,-,-,0,NULL,NULL,NULL,NULL,NULL,NULL,NULL,0
547,FUJIMAKI,PT. FUJIMAKI STEEL INDONESIA,Kawasan Industri Mitra Karawang, JL. Mitra Raya II Blok E2, Parungmulya, Ciampel, Karawang,30,1,NULL,NULL,0,1,NULL,NULL,NULL,0267-8631747,0267-8631748,Mr. Asep,0,NULL,NULL,NULL,310086850,3,NULL,PT. FUJIMAKI STEEL INDONESIA,0
548,DSM,PT. DINO SOLUSI METAL,Perum Kota Serang Baru, JL. Dukuh II C7, No 7, Desa Sukaragam-Bekasi,0,1,NULL,NULL,0,1,NULL,NULL,NULL,087804003618,NULL,Mr. Teguh,0,NULL,NULL,NULL,2416001025,2,JAKARTA,CV. DINO SOLUSI METAL,0
549,MMKI,PT.MITSUBISHI MOTORS KRAMA YUDHA INDONESIA,Kawasan (GIIC) Kota Deltamas Blok CH no.01 Pasir Ranji Cikarang Pusat Bekasi Jawa Barat 17530,NULL,1,72.050.675.7-413.000,NULL,1,0,NULL,NULL,NULL,NULL,NULL,NULL,0,NULL,NULL,NULL,NULL,NULL,NULL,NULL,0
550,SCT,PT SOLUSI CORPORINDO TEKNOLOGI,Jl. Kapuk Kamal Raya No.62E - Jakarta Utara 14470,0,0,NULL,Info@solution.co.id,0,1,NULL,NULL,NULL,+6221 5562135,+6221 55958897,Mrs Vinna,0,NULL,NULL,NULL,NULL,NULL,NULL,NULL,0
551,AIDA,PT. AIDA INDONESIA,Jl. Science Boulevard Blok A2/9, JABABEKA V Sertajaya-Cikarang Timur Bekasi JAWA BARAT 17530,NULL,1,02.419.334.4-431.000,NULL,1,NULL,NULL,NULL,NULL,NULL,NULL,NULL,0,NULL,NULL,NULL,NULL,NULL,NULL,NULL,0
552,THAI,THAI AIRWAYS INTERNATIONAL,Wisma Nusantara 26th Floor  Jl.M.H Thamrin No.59  Jakarta 10350 - Indonesia,0,0,NULL,jkt.reservation@thaiairways.com,0,1,NULL,NULL,NULL,+6221 3903588,+6221 3904318,Mrs Nila,0,NULL,NULL,NULL,NULL,NULL,NULL,NULL,0
553,Hexagon,Hexagon Metrology Asia Pacific Pte Ltd.,8 Admiralty Street #05-15 Admirax Singapore 757438,NULL,1,NULL,NULL,0,1,NULL,NULL,NULL,+65 6463 6242,+65 6463 8030,Mr. Yosua,0,NULL,NULL,NULL,NULL,NULL,NULL,NULL,0
554,ALFA,CV. ALFA MASTER JABABEKA,Jababeka II, JL. Antilop V Blok I-1, no 119, Cikarang Baru, Bekasi,30,1,NULL,NULL,0,1,NULL,NULL,NULL,021-89836725,021-89836725,Mr. Bambang,0,NULL,NULL,NULL,300800004123,18,JABABELA,CV. ALFA MASTER JABABEKA,0
555,NULL,NULL,NULL,NULL,0,NULL,NULL,NULL,1,NULL,NULL,NULL,NULL,NULL,NULL,0,NULL,NULL,NULL,NULL,NULL,NULL,NULL,1
556,SSS,PT SINAR SUKSES SEKAWAN,Pangeran Jayakarta Komplek Ruko 123 No. 16 Jakarta,30,1,NULL,sinarsukses@yahoo.com,0,1,NULL,NULL,NULL,021 6232 0811,021 6232 0812,Ibu Dewi,0,NULL,NULL,NULL,003527865178,21,CIKARANG,PT. SINAR SUKSES SEKAWAN,0
557,BBL,PT. BOGA BERSAMA LESTARI,Adiarsa Pusaka RT 002 / RW 006,NULL,1,NULL,NULL,NULL,1,NULL,NULL,NULL,0267 8452155,NULL,NULL,0,NULL,NULL,NULL,NULL,NULL,NULL,NULL,0
558,TPI,PT. TOYO PRESISI INDONESIA,JL. Gaharu III Blok G5, No 51, Desa Cicau, Cikarang Pusat,30,0,NULL,NULL,0,1,NULL,NULL,NULL,021-29617783,021-29617783,Mr. Ahmad / Mr. Asyikin,0,NULL,NULL,NULL,227501000004302,5,Cab. Cikarang
,PT. TOYO PRESISI INDONESIA,0
559,SPINDO,PT. STEEL PIPE INDUSTRY OF INDONESIA,Jl. Mitra Raya II Blok F-2  KIM Karawang  Parung Mulya, Ciampel, Karawang 40361,30,1,NULL,NULL,0,1,NULL,NULL,NULL,+62267 440823,+62267 440587,NULL,0,NULL,NULL,NULL,1093012112,1,JAKARTA,PT. SPINDO,0
560,CKI,PT. CHIYODA KOGYO INDONESIA,Jababeka II SFB Blok JJ No 18, Cikarang, bekasi,30,1,NULL,NULL,0,1,NULL,NULL,NULL,021-8937713,021-8937714,Ms. Yoanita,0,NULL,NULL,NULL,NULL,NULL,NULL,NULL,0
561,APIK,PT. ADYAWINSA PLASTICS INDUSTRIES KARAWANG,DUSUN II KP. SUKASARI RT01 RW04 CIAMPEL KARAWANG,NULL,1,21.057.201.2-431.000,NULL,1,0,NULL,NULL,NULL,NULL,NULL,NULL,0,NULL,NULL,NULL,NULL,NULL,NULL,NULL,0
562,WM,CV. WIJAYA MACHINERY,Jl. Pakin No. 2 A-B, Jakarta Utara 14440,30,1,NULL,NULL,0,1,NULL,NULL,NULL,021 669 6061 / 669 7071,021 668 2176,Bp. Aan,0,NULL,NULL,NULL,1683081551,1,CAB PLUIT,CV. WIJAYA MACHINERY,0
563,MGS,Metrology Global Service,Ruko Bukit Kencana Residence Blok C-11. Jl Bungursari, Cibeuning Kab. Purwakarta,30,1,NULL,marketing@mgscalibration.com,0,1,NULL,NULL,NULL,0264 8302200,NULL,Bpk Raim,0,NULL,NULL,NULL,NULL,NULL,NULL,NULL,0
564,TMS,PT. TRI MULIA SEJAHTERA (Catering),Jl. Cakradireja Blok A No. 7 Karawang,0,0,NULL,Mitracatering@alexandria.cc,NULL,1,NULL,NULL,NULL,0267 411580,406406,NULL,0,NULL,NULL,NULL,0001921191,3,KARAWANG,PT. TRI MULIA SEJAHTERA,0
565,HAC,PT. HATEK ANUGRAH CEMERLANG,Metland Cibitung Blok P6 No.6 - Cikarang Barat, Jawa Barat 17520,30,1,NULL,arif.hatek@gmail.com,0,1,NULL,NULL,NULL,+622129480358 || +6281287597733,+622129480358,Bpk Arif Setiawan,0,NULL,NULL,NULL,1560010772525,12,TAMBUN,PT. HATEK ANUGRAH CEMERLANG,0
567,ADIKU,PT. ANUGERAH DAYA INDUSTRI KOMPONEN UTAMA,Kawasan Industri Jababeka Tahap V Jl. Science Timur, Blok A5 H Kel. Cibatu,NULL,1,NULL,admin@adiku.co.id,0,1,NULL,NULL,NULL,021-89845611,021-89845612,NULL,0,NULL,NULL,NULL,NULL,NULL,NULL,NULL,0
568,CHI,PT. CHUHATSU INDONESIA,Jalan K.H. Noer Alie, Cibitung Bekasi 17520 Jawa Barat, Indonesia,NULL,1,NULL,NULL,NULL,1,NULL,NULL,NULL,021-8833-0010,021-8833-0011,NULL,0,NULL,NULL,NULL,1250096037429,12,BEKASI,PT. CHUHATSU INDONESIA,0
569,BSJ,PT Bharaka Sarana Jaya,ALDEVCO OCTAGON Building Lt 3  Jl.Warung Buncit Raya No.75 , Jakarta Selatan 12740,30,1,NULL,dudy@bharaka.co.id,0,1,NULL,NULL,NULL,+6221 79186571,+6221 79186570,Bpk Yudhi Rinaldo,0,NULL,NULL,NULL,1270006613572,12,JAKARTA,PT. BHARAKA SARANA JAYA,0
570,MKSD,PT. MULTIKARYA SINARDINAMIKA,Jl. Wahab Affan No. 41, Pondok Ungu - Bekasi,30,1,NULL,edy@mksd.co.id,0,1,NULL,NULL,NULL,021-8840940,021-8859727,Bp. Edy,0,NULL,NULL,NULL,0663046788,1,BEKASI,PT. MULTIKARYA SINARDINAMIKA,0
571,SURYAMAS,PT. SURYAMAS AKURASI,Delta Silicon Industrial park  JL. Meranti 1 Blok L2-3A, Lemah Abang,30,1,NULL,NULL,NULL,1,NULL,NULL,NULL,02189118268,02189118265,Mr. Suito Fang,0,NULL,NULL,NULL,NULL,NULL,NULL,NULL,0
572,SII,PT Sinergi Inti Industri,Jl. Lapangan Bola RT 001 RW 03 No.81  Kel.Sumur Batu, Bantar Gebang - Bekasi 17154,30,1,NULL,heryantoagus@yahoo.com,0,1,NULL,NULL,NULL,+6221 29366442,+6221 2936644,Bpk Agus Heryanto,0,NULL,NULL,NULL,1031031231,3,BOGOR,PT SINERGI INTI INDUSTRI,0
573,MBJ,PT. MESAH BRAKHA JAYA,Jl. Gading Putih IV Blok A3 No.1 Kelapa Gading Timur Kelapa Gading, Jakarta Utara,30,1,NULL,susanto.adjie@brakhacorp.com,0,1,NULL,NULL,NULL,021 9539 8800,021 453 1879,Bpk. Susanto,0,NULL,NULL,NULL,NULL,NULL,NULL,NULL,0
574,SIM,PT. SUZUKI INDOMOBIL MOTOR,Jln. Let Jend M.T. Haryono Kav. 8,0,1,NULL,NULL,NULL,1,NULL,NULL,NULL,021 88347883 (ext.9007),NULL,NULL,0,NULL,NULL,NULL,NULL,NULL,NULL,NULL,0
575,VSI,PT VENETA INDONESIA,mangga Dua Abdad No.5 I, Jakarta 10730 - Indonesia,0,0,NULL,mail@venetaindonesia.com,0,1,NULL,NULL,NULL,+6221 6123124,+6221 6256269,Bpk Hery Heryatna,0,NULL,NULL,NULL,NULL,NULL,NULL,NULL,0
576,SLAB,SUMMIT LAEMCHABANG AUTO BODY WORK CO.,LTD,38/15 Mu 5 Laemchabang Industrial Estate, Tungsukla, Sriracha, Cholburi 20230, Thailand,0,0,0105534004222,NULL,0,1,NULL,NULL,NULL,NULL,NULL,NULL,0,NULL,NULL,NULL,NULL,NULL,NULL,NULL,0
