-18,HATEX,PT. HATEX ANUGRAH CEMERLANG,Metland Cibitung blok P6 No 6 Cikarang Barat Bekasi,NULL,1,NULL,NULL,1,1,NULL,NULL,NULL,021-29480358,NULL,NULL,0,NULL,NULL,NULL,NULL,NULL,NULL,NULL,0
-17,BAJA SATYA PRATAMA,PT BAJA SATYA PRATAMA,Jl. Gempol Sari No. 340 Cijerah Bandung 40215,NULL,1,NULL,NULL,1,1,NULL,NULL,NULL,6034906,NULL,NULL,0,NULL,NULL,NULL,NULL,NULL,NULL,NULL,0
-16,BLSI,BLSI HK-PATI, JL. INSPEKSI TARUM BARAT. Ds. PARUNG MULYA Kec. CIAMPEL-KARAWANG INDONESIA 41361 - (0267) 8630555 ,NULL,1,NULL,NULL,NULL,1,NULL,NULL,NULL,(0267) 8630555,NULL,NULL,0,NULL,NULL,NULL,NULL,NULL,NULL,NULL,0
-15,PUTRA MANDIRI,PT. PUTRA MANDIRI,CIBINONG - BOGOR,NULL,1,NULL,NULL,1,1,NULL,NULL,NULL,,NULL,NULL,0,NULL,NULL,NULL,NULL,NULL,NULL,NULL,0
-14,ACME,PT. ALINDO (ACME),Cikarang - Bekasi,NULL,1,NULL,NULL,NULL,1,NULL,NULL,NULL,-,NULL,NULL,0,NULL,NULL,NULL,NULL,NULL,NULL,NULL,0
-13,SUPPLIER,PT. Mitsuyoshi Manufacturing Indonesia,Cinangka, Bungursari, Purwakarta Regency, West Java 41181,NULL,1,NULL,NULL,NULL,1,NULL,NULL,NULL,0267,NULL,NULL,0,NULL,NULL,NULL,NULL,NULL,NULL,NULL,0
-12,554433,PT. MITSUYOSHI,CIKAMPEK,30,1,,,0,1,0,0,NULL,,,,0,NULL,NULL,NULL,NULL,0,,,0
-11,Jaya,PT. Jaya Induksi,Pinayungan teluk jambe Karawang Timur,NULL,1,NULL,NULL,NULL,1,NULL,NULL,NULL,,NULL,NULL,0,NULL,NULL,NULL,NULL,NULL,NULL,NULL,0
-10,19092017,CV. Arta Tirta Mandiri (Anindya RO),Perum Green Garden Lamaran Karawang,NULL,1,NULL,NULL,NULL,1,NULL,NULL,NULL,,NULL,NULL,0,NULL,NULL,NULL,NULL,NULL,NULL,NULL,0
-9,PT. FSI SURYACIPTA,PT. FUJI SEAT INDONESIA,Kawasan Industri Surya Cipta Karawang,NULL,1,NULL,NULL,NULL,1,NULL,NULL,NULL,-,NULL,NULL,0,NULL,NULL,NULL,NULL,NULL,NULL,NULL,0
-8,PALET BACK TOP PLATE,PT.WOOIN,KAWASAN MM2100,NULL,1,NULL,NULL,1,1,NULL,NULL,NULL,,NULL,NULL,0,NULL,NULL,NULL,NULL,NULL,NULL,NULL,0
-7,Guna,PT. Guna Alfa Global,Cisaat - Sukabumi,NULL,1,NULL,NULL,1,1,NULL,NULL,NULL,,NULL,NULL,0,NULL,NULL,NULL,NULL,NULL,NULL,NULL,0
-6,PT. PMI,PT. PRESS MOLD INDONESIA,Jl. Jababeka II, Blok CC No. 18A,  Pasirgombong, Cikarang Utara, Bekasi, Jawa Barat 17530,NULL,1,NULL,NULL,NULL,1,NULL,NULL,NULL,-,NULL,NULL,0,NULL,NULL,NULL,NULL,NULL,NULL,NULL,0
-5,SUPPLIER,PT. Mega Pratama Teknindo,Jl. Griya Hijau Raya 45 Pakulonan Serpong Utara Tangerang Selatan Banten, Serpong, Kota Tangerang Selatan, Banten 15144,NULL,1,NULL,NULL,NULL,1,NULL,NULL,NULL,(021) 53122709,NULL,NULL,0,NULL,NULL,NULL,NULL,NULL,NULL,NULL,0
-4,CUSTOMER,PT. BLSI DUNEX,Desa Parungmulya, Kecamatan Ciampel, Parungmulya, Ciampel, Kabupaten Karawang, Jawa Barat 41363,NULL,1,NULL,NULL,NULL,1,NULL,NULL,NULL,(0267) 440808,NULL,NULL,0,NULL,NULL,NULL,NULL,NULL,NULL,NULL,0
-3,Alva,PT. Alva Betha Presisindo,Jl. Kemuning No 8 RT 003 RW 005 Bojong menteng, Rawa lumbu - Bekasi,NULL,1,NULL,NULL,1,1,NULL,NULL,NULL,(021)82614066,NULL,NULL,0,NULL,NULL,NULL,NULL,NULL,NULL,NULL,0
-2,10082017,PT. Sinergi Multi Talenta,Cikarang - Bekasi,NULL,1,NULL,NULL,NULL,1,NULL,NULL,NULL,,NULL,NULL,0,NULL,NULL,NULL,NULL,NULL,NULL,NULL,0
-1,YOROZU,PT.YOROZU AUTOMOTIVE INDONESIA, Kawasan Industri Mitra Karawang, JI. Mitra Barat III Blok L6 - 8, Ciampel, Parungmulya, Ciampel, Kabupaten Karawang, Jawa Barat 41363,NULL,1,NULL,NULL,1,1,NULL,NULL,NULL,(0267) 8637974,NULL,NULL,0,NULL,NULL,NULL,NULL,NULL,NULL,NULL,0
1,ASI,PT. ADYAWINSA STAMPING INDUSTRIES,Jl. Surotokunto Dusun Krajan I, Klari Karawang, Jawa Barat,30,1,02.425.214.0-431.000,NULL,1,NULL,NULL,NULL,NULL,NULL,NULL,NULL,0,0,0,0,NULL,NULL,NULL,NULL,0
9,ITSA,PT. INDONESIA THAI SUMMIT AUTO,Jln. Permata Raya Kawasan Industri KIIC Lot FF-5 Teluk Jambe Timur, Karawang-Jawa Barat- 41361,30,1,02.519.870.6-055.000,NULL,1,NULL,NULL,NULL,NULL,NULL,NULL,NULL,0,NULL,NULL,0,NULL,NULL,NULL,NULL,0
11,GMIM,PT. GENERAL MOTORS INDONESIA MANUFACTURING,Jl. Raya Bekasi Km. 27 PD. Ungu RT007/006 Medan Satria- Medan Satria, Kota Bekasi- Jawa Barat,47,1,31.271.621.0-431.000,NULL,1,NULL,NULL,NULL,NULL,NULL,NULL,NULL,0,NULL,NULL,0,NULL,NULL,NULL,NULL,0
12,GMO,PT. GENERAL MOTORS INDONESIA MANUFACTURING,Jl. Raya Bekasi Km. 27 PD. Ungu RT007/006 Medan Satria- Medan Satria, Kota Bekasi- Jawa Barat,47,1,31.271.621.0-431.000,NULL,1,NULL,NULL,NULL,NULL,NULL,NULL,NULL,0,NULL,NULL,0,NULL,NULL,NULL,NULL,0
21,ADK,PT. ADYAWINSA DINAMIKA KARAWANG,Jl. By Pass Pangkal Perjuangan 98 RT 05 RW 15 Tanjung Pura, Karawang 41316,30,1,02.312.200.5-431.000,NULL,1,1,NULL,NULL,NULL,NULL,NULL,NULL,0,NULL,NULL,0,NULL,NULL,NULL,NULL,0
27,BELLSONICA,PT. BELLSONICA INDONESIA,Kawasan GIIC Blok AC No. 01 Sukamahi - Cikarang Pusat Bekasi,30,1,31.463.545.9-413.000,NULL,1,NULL,NULL,NULL,NULL,NULL,NULL,NULL,0,NULL,NULL,0,NULL,NULL,NULL,NULL,0
35,EMI,PT. EXEDY MANUFACTURING INDONESIA,JL. PERMATA V LOT EE-3 KAWASAN INDUSTRI KIIC TELUK JAMBE TIMUR- KARAWANG, JAWA BARAT- 41361,30,1,01.061.542.5-055.000,NULL,1,NULL,NULL,NULL,NULL,NULL,NULL,NULL,0,NULL,NULL,0,NULL,NULL,NULL,NULL,0
39,FSI,PT. FUJI SEAT INDONESIA,Gudeng Sunter Podomoro, Jl Agung Perkasa IX Blok k I No 9-15, Sunter Agung Tanjung Priok - jakarta Utara, Indonesia,30,1,02.519.892.0-055.000,NULL,1,NULL,NULL,NULL,NULL,NULL,NULL,NULL,0,NULL,NULL,0,NULL,NULL,NULL,NULL,0
41,GMI,PT. GENERAL MOTORS INDONESIA,Pondok Indah Office Tower 3 Lt. 16 Suite 1601 Jl. Sultan Iskandar Muda Kav V-TA, Pondok Pinang, Kebayoran Lama, Jakarta Selatan, DKI Jakarta 12310,47,1,01.070.701.6-055.000,NULL,1,NULL,NULL,NULL,NULL,NULL,NULL,NULL,0,NULL,NULL,0,NULL,NULL,NULL,NULL,0
67,MPI,PT. MANDIRI PRATAMA INTILOGAM,Jl. Raya Cikarang Karawang Km. 29 No. 28 Rt.04/01 Tanjung B Cikarang Timur - Bekasi , Indonesia,30,1,02.559.285.8-431.000,NULL,1,NULL,NULL,NULL,NULL,NULL,NULL,NULL,0,NULL,NULL,0,NULL,NULL,NULL,NULL,0
68,MAJ,PT. MEKAR ARMADA JAYA,Jl. Diponegoro KM.38 No.107 Jati Mulya,30,1,01.107.593.4-524.000,NULL,1,NULL,NULL,NULL,NULL,NULL,NULL,NULL,0,NULL,NULL,0,NULL,NULL,NULL,NULL,0
72,MSI,PT. MAH SING INDONESIA,Kawasan Industri Jababeka Blok W 17-20, Lemah Abang Cikarang Bekasi- 17550,30,1,01.071.364.2-052.000,NULL,1,NULL,NULL,NULL,NULL,NULL,NULL,NULL,0,NULL,NULL,0,NULL,NULL,NULL,NULL,0
73,MEIWA,PT. MEIWA INDONESIA,Jl. Raya Bogor KM.30 Sukamaju Baru Cimanggis, Depok - 16591,30,1,01.001.755.6-052.000,NULL,1,NULL,NULL,NULL,NULL,NULL,NULL,NULL,0,NULL,NULL,0,NULL,NULL,NULL,NULL,0
76,MKM,PT. MITSUBISHI KRAMA YUDHA & MANUFACTURING,Jl. Raya Bekasi Km.21-22, Pulo Gadung JAKARTA - 13920,30,1,01.002.830.6.092.000,NULL,1,NULL,NULL,NULL,NULL,NULL,NULL,NULL,0,NULL,NULL,0,NULL,NULL,NULL,NULL,0
82,POSMI,PT. POSMI STEEL INDONESIA,Kawasan Industri MM2100 Blok H-4-1 Ganda Mekar,Cikarang Barat,Bekasi 17520,NULL,1,01.071.481.4-055.000,NULL,1,NULL,NULL,NULL,NULL,NULL,NULL,NULL,0,NULL,NULL,0,NULL,NULL,NULL,NULL,0
92,SEID,PT. SHARP ELECTRONICS INDONESIA,JL.HARAPAN RAYA LOT LL-1&2 KAWASAN INDUSTRI KIIC SIRNABAYA, TELUKJAMBE TIMUR KARAWANG JAWA BARAT 41361,70,1,01.001.880.2.092.000,NULL,1,NULL,NULL,NULL,NULL,NULL,NULL,NULL,0,NULL,NULL,0,NULL,NULL,NULL,NULL,0
95,SIM,PT. SUZUKI INDOMOBIL MOTOR,JL. RAYA BEKASI KM.19 RT.009 RW.01 RAWA TERATE CAKUNG JAKARTA TIMUR DKI JAKARTA,30,1,01.061.996.3-092.000,NULL,1,NULL,NULL,NULL,NULL,NULL,NULL,NULL,0,0,NULL,0,NULL,NULL,NULL,NULL,0
98,TRIX,PT. TRIX INDONESIA,Jl. Maligi IV lot K-1 E1, Kawasan Industri KIIC Karawang - 41361,30,1,01.869.637.7-055.000,NULL,1,NULL,NULL,NULL,NULL,NULL,NULL,NULL,0,NULL,NULL,0,NULL,NULL,NULL,NULL,0
103,TMMIN,PT. TOYOTA MOTOR MANUFACTRING INDONESIA,Jl. Laksamana Yos Sudarso, Sunter II Jakarta Utara - 14330,30,1,01.000.099.0-092.000,NULL,1,NULL,NULL,NULL,NULL,NULL,NULL,NULL,0,NULL,NULL,0,NULL,NULL,NULL,NULL,0
120,V1,Vendor1 (X),Jakarta,30,1,11.111.22.33.3,NULL,NULL,1,NULL,NULL,NULL,534353,5675675,NULL,0,NULL,NULL,NULL,NULL,NULL,NULL,NULL,0
122,TWTHUMBS,TWO THUMBS,Blok A Lantai 1 Los A/40 TANAH ABANG JAKARTA PUSAT,0,0,NULL,NULL,0,1,NULL,NULL,NULL,081281998056 / 08811607071,NULL,,0,NULL,NULL,NULL,NULL,NULL,NULL,NULL,0
123,KIANIS,PT. KIANIS PRATAMA,Jl. Raya Bekasi KM 21.5 Pulo Gadung. Jakarta Timur,30,1,NULL,NULL,0,1,NULL,NULL,NULL,081378639094/085882622246,021-46830708,Bp. Suwito,0,NULL,NULL,NULL,252638127,3,PLAZA BUMI DAYA,PT. KIANIS PRATAMA,0
124,MSS,CV. MITRA SARANA SOLUSI,Jl. Kedungwaringin Blok A1 No.8, Kedung Waringin. Bekasi,30,1,NULL,NULL,NULL,1,NULL,NULL,NULL,021 85941065 / 021 89140350,021-89140323,Bp. Syarifudin,0,NULL,NULL,NULL,7056620995,22,JAKARTA,CV. MITRA SARANA SOLUSI,0
125,CASH-KRW,CASH - KARAWANG,KARAWANG,0,0,NULL,NULL,NULL,1,NULL,NULL,NULL,NULL,NULL,NULL,0,NULL,NULL,0,NULL,NULL,NULL,NULL,0
126,RATU,TOKO RATU MANDIRI,JL. Citarum 10 no. 21 Cikarang utara,14,1,NULL,NULL,NULL,1,NULL,NULL,NULL,08128967802,NULL,Bp. Ardius,0,NULL,NULL,0,053701029580501,5,KARAWANG,ARDIUS OLOAN,0
127,IGAW,INTI GUNA AGRAWISESA,Jl. Pisangan Lama III / 9 Jakarta,45,0,NULL,NULL,NULL,1,NULL,NULL,NULL,021 6522777,021 652 2021,Bp. Dennis / Bp. Vorit,0,NULL,NULL,0,1902014466,15,METRO KENCANA,TRI MERIANI,0
128,HIROMINDO,PT. HIROMINDO PERKASA,Komplek Metro Sunter , Jl. Metro Kencana VII Blok Q 30 Jakarta,45,1,NULL,NULL,NULL,1,NULL,NULL,NULL,021 6522777,021 6522021,Bp. Vorit,0,NULL,NULL,0,1905000775,15,METRO KENCANA,PT. HIROMINDO PERKASA,0
129,HARCO,TOKO HARCO COMPUTER CENTRE,Glodok Harco Lantai  II Blok C/54 Jakarta,30,0,NULL,NULL,NULL,1,NULL,NULL,NULL,021 626 2116,021 6264968,Ci Yenni,0,NULL,NULL,NULL,0821065029,1,GLODOK,CHUI PING,0
130,PRIMA,TOKO PRIMA COMPUTER,Jl. Arief Rahman Hakim No. 20 ( Niaga ) Karawang,30,0,NULL,NULL,NULL,1,NULL,NULL,NULL,0267 8453920, 7013473 ,  9117108,0267 8454324,Ko Adrian,0,NULL,NULL,NULL,NULL,NULL,NULL,NULL,0
131,EP,ENCEHA PACIFIC,KOMP. Metro Sunter , Jl, Kencana  VII BLOK Q30 Jakarta,45,0,NULL,NULL,NULL,1,NULL,NULL,NULL,021 6522777,021 6521750,Ibu Lisa,0,NULL,NULL,NULL,NULL,NULL,NULL,NULL,0
132,NIJU,PT. NUSA INDAH JAYA UTAMA,Jl. Raya Pulo Gebang Rt 012 Rw 006 Pulo Gebang, Cakung, Jakarta Timur,30,1,02.182.710.0-006.000,NULL,1,1,NULL,NULL,NULL,02168800803,021 6594684,Bp. Tanu,0,NULL,NULL,0,NULL,NULL,NULL,NULL,0
133,JSU,CV. JOHAR SEMESTA UTAMA,Jl. H.Simbang  II / 33 KA Tengah Bekasi  17125,30,0,NULL,NULL,NULL,1,NULL,NULL,NULL,021 88881122,021 88881122,Bp. Ashar,0,NULL,NULL,0,7410277845,1,BEKASI,SARI WAHYUNINGSIH,0
134,GE,CV. GEMA ELEKTRIK,Jl. Onik 9 No.2  KOMPLEK PERMATA REGENCY - Cikampek,30,0,NULL,NULL,0,1,NULL,NULL,NULL,0264 305805 / 081380197913,0264 305805,Bp. Asep Sopyan,0,NULL,NULL,0,030201000657300,5,CIKAMPEK,CV. GEMA ELEKTRIK,0
135,MT,TOKO MITRA TECHNINDO,Komp. Glodok Jaya, LT. 4 Blok C - JAKARTA,30,0,NULL,NULL,0,1,NULL,NULL,NULL,021 6591144 / 021 6590570,021 6591144,Ko Abi / Ko aron,0,NULL,NULL,0,NULL,NULL,NULL,NULL,0
136,KEI,PT. KURODA ELEKTRIK INDONESIA,Cikarang Tehnopark Building 3A , Jl. Inti Blok C1/ 7 Lippo Cikarang,30,1,NULL,NULL,NULL,1,NULL,NULL,NULL,021 89902390,021 89902415,Ibu Maya,0,NULL,NULL,0,NULL,NULL,NULL,NULL,0
137,TMS,PT. TIMUR MEGAH STEEL,Jl. Tanah Pasir No. 45N Jakarta,30,1,NULL,NULL,NULL,1,NULL,NULL,NULL,021 8661 2534,021 6694839,Bp. Andreas , Ibu Annisa,0,NULL,NULL,0,NULL,NULL,NULL,NULL,0
138,KOSIM,BAPAK KOSIM,Karawang,NULL,0,NULL,NULL,NULL,1,NULL,NULL,NULL,087879187776,NULL,Bp. Kosim,0,NULL,NULL,0,NULL,NULL,NULL,NULL,0
139,NULL,%OERLIKON,NULL,NULL,1,NULL,NULL,NULL,1,NULL,NULL,NULL,NULL,NULL,NULL,0,NULL,NULL,0,NULL,NULL,NULL,NULL,1
140,MMJ,TOKO MEKAR MAS JAYA,Pertokoan Glodok Jaya LT. II Blok C No. 39  Jakarta,30,0,NULL,NULL,NULL,1,NULL,NULL,NULL,021 62309132,021 62309133,Ko Aliong,0,NULL,NULL,0,6900050605,1,JAKARTA,HENI MEYLINDA,0
141,BELT,PT. BIMA ESTETIKA LESTARI TANGGUH,Jl. Melawan No. 75 Pangeran Jayakarta , Jakarta Pusat,14,1,NULL,NULL,NULL,1,NULL,NULL,NULL,021 6257433,021 6292003,Bp. Temmy,0,NULL,NULL,0,0840389618,1,WISMA ASIA,PT. BIMA ESTETIKA LESTARI TANGGUH,0
142,OHS,PT. ONE HEART SOLUTION,Cikarang Permai Blok H1 / 4 Cikarang selatan,30,1,NULL,NULL,NULL,1,NULL,NULL,NULL,021 29093719,021 29093719,Bp. Lieder,0,NULL,NULL,0,0701571533,16,JAKARTA,PT. ONE HEART SOLUTION,0
143,IWATANI,PT. IWATANI INDUSTRIAL GAS INDONESIA,Plot A-12 Teluk Jambe Karawang  KIIC,45,1,NULL,NULL,NULL,1,NULL,NULL,NULL,021 890 4310,021 890 4372,Ibu Dian,0,NULL,NULL,0,665160404,4,JAKARTA,PT. IWATANI INDUSTRIAL GAS INDONESIA,0
144,GI,CV. GARISH INDOESPEC,Kavling Permata Griya Satria Blok S No 11 RT 006 Bekasi,30,1,NULL,NULL,NULL,1,NULL,NULL,NULL,021 88357910,+6221 88357898,Ibu Retni,0,NULL,NULL,0,1670000911981,12,BEKASI,CV. GARISH INDOESPEC,0
145,ADW-KONST,PT. ADYAWINSA KONSTRUKSI,Jl. Jababeka V - Jababeka,NULL,1,NULL,NULL,NULL,1,NULL,NULL,NULL,021 8936001,0218936002,Ibu Lingki /Bp. Masjud,0,NULL,NULL,0,1218538432,16,CIKARANG,PT. ADYAWINSA DINAMIKA,0
146,JSB,UD. JAYA SELANG BARU,Jl. Tuparev No. 346 Cinangoh - Karawang,30,0,NULL,NULL,NULL,1,NULL,NULL,NULL,0267 416027,0267 416027,Bp. Kismanto,0,NULL,NULL,0,3433001679,1,KARAWANG,UD. JAYA SELANG BARU,0
147,OLM,PT. OMEGA LESTARI MANDIRI,Jl. Kertabumi No. 38 KARAWANG,7,1,NULL,NULL,NULL,1,NULL,NULL,NULL,0267 402539,0267 402539,Bp. Atang,0,NULL,NULL,0,1093023238,1,KARAWANG,PT. OMEGA LESTARI MANDIRI,0
148,CATRA,PT. CATRA TOOLSINDO,Jl. Merak Blok G1 No. 123 Cikarang Baru,30,1,NULL,NULL,NULL,1,NULL,NULL,NULL,021 89833406,021 89833407,Bp. Edi,0,NULL,NULL,0,NULL,NULL,NULL,NULL,0
149,PB,TOKO PRIMA BAN,Jl. Raya Cibarusah - Cikarang,30,0,NULL,NULL,NULL,1,NULL,NULL,NULL,021 8990 2628,021 8970578,Bp. Suwandi,0,NULL,NULL,0,NULL,NULL,NULL,NULL,0
150,KRI,PT. KRISBOW INDONESIA,Jln. Kerta Bumi No.4 RT 11/18 Karawang Kulon, Karawang Barat,30,1,NULL,NULL,NULL,1,NULL,NULL,NULL,0267 8454716,0267 8454733,Bp. Dindin,0,NULL,NULL,0,7090909970,1,JAKARTA,PT. KRISBOW INDONESIA,0
151,INDOBEST,PT. INDO BEST WELDER & HEATER,Royal Sunter Blok C/ 8 , Jl. Danau Sunter Selatan Jakarta 14350,30,1,NULL,NULL,NULL,1,NULL,NULL,NULL,021 6520888,021 6515528,Bp. Eko,0,NULL,NULL,0,6590888689,1,JAKARTA,PT. INDO BEST WELDER & HEATER,0
152,BTI,PT. BERLIAN TECHPRINT INDONESIA,Kawasan Industri Batik -Lippo Cikarang,45,0,NULL,NULL,NULL,1,NULL,NULL,NULL,021 8990 2119,021 89902120,Ko. Sanjaya,0,NULL,NULL,0,NULL,NULL,NULL,NULL,0
153,PAP,PT. PETROTEC AIR POWER,JL.Mahoni 2 / 6 Kawasan Industri  Lippo Cikarang,60,1,NULL,NULL,NULL,1,NULL,NULL,NULL,02189900583,02189900570,Bp. Prasetyo,0,NULL,NULL,0,1770100343003,7,JAKARTA,PT. PETROTEC AIR POWER,0
154,MTL,PT. METACOM KARUNIA LESTARI,Jl. Ternate No. 12 D, Jakarta  10130,30,1,NULL,ptmetacom@gmail.com,NULL,1,NULL,NULL,NULL,021 63856064, 081291254474,021 6332960,Ibu Ita Winarti,0,NULL,NULL,0,5440302744,1,Jakarta,PT. METACOM KARUNIA LESTARI,0
155,KSJ,PT. KOMANDO SIJALAK,Apartemen Taman Rasuna Tower 15LDB KT01, Jakarta Selatan,30,1,NULL,NULL,NULL,1,NULL,NULL,NULL,08882883343,08562929085,Bp. Andhie Widcakso,0,NULL,NULL,0,NULL,NULL,NULL,NULL,0
157,JC,CV. JASA CEMERLANG,Jl. Pademangan IV Timur Raya Gg. 28/29 no. 29 Jakarta 14410,30,1,NULL,NULL,NULL,1,NULL,NULL,NULL,021 6408346,7 / 021 6412074,021 6412073,Ibu Iskandar,0,NULL,NULL,0,0023224086,1,JAKARTA,CV. JASA CEMERLANG,0
158,QSE,TOKO QUEENSTAR ELECTRIC,LTC Glodok , Jl. Hayam Wuruk No. 127 GF 1 Blok A2/ 3 Jakarta,30,0,NULL,NULL,0,1,NULL,NULL,NULL,021 6286254,021 62201809,Bp. Hendra,0,NULL,NULL,0,1941067196,1,JAKARTA,HENDRA,0
159,SRS,PT. SINAR RAFLESIA SELATAN,Jl. Boulevard Hijau Kav. Sentra Niaga Bekasi Barat  17131,30,1,NULL,NULL,NULL,1,NULL,NULL,NULL,021 88875279,021 88976571,Bp. Sumarjuni , Ibu Sri Wurniati,0,NULL,NULL,0,1560010051573,12,JAKARTA,PT. SINAR RAFLESIA SELATAN,0
160,MSS,PT. MANDIRI SUKSES SENTOSA,Jl. RE Martadinata Ruko Permata ancol Blok G/ 16  JAKARTA,14,1,NULL,NULL,NULL,1,NULL,NULL,NULL,021 64711975,021 6472008,Ibu Nining,0,NULL,NULL,0,NULL,NULL,NULL,NULL,0
162,BRJ,PD. BUMI RAYA JAYA,Jl. Arteri Tol Karawang Barat No. 11,14,0,,NULL,0,1,NULL,NULL,NULL,0267-8453328,0267-409888,IBU DIAH,0,NULL,NULL,0,NULL,NULL,NULL,NULL,0
163,LIPPO,PD. LIPPO BANGUNAN,Jl. Raya SERANG  - CIBARUSAH , CIKARANG,30,0,NULL,NULL,NULL,1,NULL,NULL,NULL,021 89677036,021 89677035,Bp. Thamrin,0,NULL,NULL,0,NULL,NULL,NULL,NULL,0
164,TS,PT. TRIMITRA SWADAYA,Jln. Meranti I No.7 - 8A  Delta Silicon I - Lippo Cikarang, Bekasi,30,1,NULL,NULL,0,1,NULL,NULL,NULL,021 89117520,021 89117522,Bpk Bimbi,0,NULL,NULL,0,NULL,NULL,NULL,NULL,0
165,ED,CV. ERA DINAMIKA,Jl. Telokm Padurenan Bantar Gebang - Bekasi,30,0,NULL,NULL,NULL,1,NULL,NULL,NULL,021 8252040,021 825 2040,Bp. Rudi,0,NULL,NULL,0,0668717171,1,JAKARTA,RUDIANTO,0
166,RA,PT. REMALA ABADI,Jl. Raya Komsen No.73 RT 003 RW 005  Kel. Jatiasih  Kec. Jatiasih - Bekasi,NULL,0,NULL,Billing@tachyon.net.id,NULL,1,NULL,NULL,NULL,+6221 83709135,NULL,Ibu Verah W,0,NULL,NULL,0,2303003614,1,JAKARTA,PT. REMALA ABADI,0
167,CASH-JKT,CASH - JAKARTA,JAKARTA,0,0,NULL,NULL,NULL,1,NULL,NULL,NULL,NULL,NULL,NULL,0,NULL,NULL,0,NULL,NULL,NULL,NULL,0
168,PST,PT. PERMATA SURYA TEKNIK,CENTRAL PARK CIKARANG , BLOK C3/ 16 CIKARANG,30,0,NULL,NULL,NULL,1,NULL,NULL,NULL,02149049396,021 49049397,Bp. Narto,0,NULL,NULL,0,NULL,NULL,NULL,NULL,0
169,DJA,PT. DACO JAYA ABADI,Jl. Kaliandra 1 Blok F6 No.1N , Kawasan Industri Delta Silicon 2 - Lippo Cikarang , Bekasi 17550,30,1,NULL,NULL,0,1,NULL,NULL,NULL,021 89902585 , 021 89902587,021 89902523,Bpk D. Prakoso,0,NULL,NULL,0,5490305027,1,CIKARANG,PT. DACO JAYA ABADI,0
170,SMS,PT. SINTESA METAL SUKSES,Jl. A. Yani  No.2 Perkantoran  Pulo Mas Satu  Gedung VLL Pulomas - Jakarta Timur,30,1,NULL,NULL,NULL,1,NULL,NULL,NULL,021 4898118,021 4756915,Ibu Lilis,0,NULL,NULL,0,4770117009,1,SAMANHUDI,PT. SINTESA METAL SUKSES,0
171,NKC,PT. NUR KARTIKA CEMERLANG,Wisma 46 Kota BNI 43rd Floor, Jl.Jendral Sudirman Kav 1 - Jakarta 10220,14,1,NULL,NULL,0,1,NULL,NULL,NULL,021 89842810,021 89842809,Maman K,0,NULL,NULL,0,NULL,NULL,NULL,NULL,0
172,AJ,TOKO ANEKA JAYA,Jl. Cikarang - Cikarang,30,0,NULL,NULL,NULL,1,NULL,NULL,NULL,021 89842001,,Ibu Fanny,0,NULL,NULL,0,1211620494,16,JAKARTA,ANEKA JAYA,0
173,PAT,PT. PUTRA ALAM TEKNOLOGI,TAMAN SENTOSA BLOK A6 NO I, CIKARANG - BEKASI,30,1,NULL,NULL,NULL,1,NULL,NULL,NULL,NULL,NULL,Ibu. Elvy,0,NULL,NULL,0,296915442,3,BEKASI,PT. PUTRA ALAM TEKNOLOGI,0
174,SMU,CV. SETYA MITRA USAHA,Perkampungan Industri Kecil (PIK)  Blok E No.285-286  Kel.Penggilingan  Kec.Cakung  -  Jakarta Timur,30,1,NULL,NULL,0,1,NULL,NULL,NULL,021 46837078,021 46837078,Bpk Darliyus,0,NULL,NULL,0,NULL,NULL,NULL,NULL,0
175,SYNCRUM,PT. SYNCRUM LOGISTICS,Jl. Selayar Kav B2-MM2100 Industrial Estate Bekasi,30,1,NULL,NULL,NULL,1,NULL,NULL,NULL,021 89983700,021 89982500,Bp. Essaf / Bp. Ardi,0,NULL,NULL,0,NULL,NULL,NULL,NULL,0
176,PPS,PT. PASAR PAGI SUKSES,Ruko Olimpic Square Jl. Sriwijaya No. 21 Lippo Cikarang,30,1,NULL,NULL,NULL,1,NULL,NULL,NULL,021 8990 3076 , 021 8990 7053,021 8990 0907,Bp. Ricky,0,NULL,NULL,0,NULL,NULL,NULL,NULL,0
177,BJ,PD. BINTANG JAYA,Jl. Tuparev No. 413 B - Karawang  Jawa Barat,30,0,NULL,NULL,NULL,1,NULL,NULL,NULL,0267 405262, 021 98156867,0267 405065,Ibu erni,0,NULL,NULL,0,NULL,NULL,NULL,NULL,0
178,ADSI,PT. ASTRA DAIDO STEEL INDONESIA,JL. Kasir Pasir Jaya Kec. Jatiwulung Tangerang,45,1,NULL,NULL,NULL,1,NULL,NULL,NULL,NULL,NULL,NULL,0,NULL,NULL,0,016621600008,1,TANGERANG,PT. ASTRA DAIDO STEEL INDONESIA,0
182,FJM,PT. FANAH JAYA MAINDO,Kawasan Industri Delta Silicon 3  Jl.Pinang Blok F16 No.11 Lippo Cikarang  -  Bekasi 17550,30,1,NULL,NULL,0,1,NULL,NULL,NULL,021 89908556,021 89908557,Bpk Hantoro,0,NULL,NULL,0,800107755400,7,LIPPO,PT. FANAH JAYA MAINDO,0
183,BMC,PT. BAJA MANDIRI CEMERLANG,JL. Raya Cibarusah No. 75 Cikarang,45,1,NULL,NULL,NULL,1,NULL,NULL,NULL,NULL,NULL,NULL,0,NULL,NULL,NULL,3013005530,19,ASEMKA JAKARTA,PT. BAJA MANDIRI CEMERLANG,0
184,ASSAB,PT. ASSAB STEEL INDONESIA,Pulogadung Industrial Estate Jl. Rawa Gelam III No. 5,45,1,NULL,NULL,NULL,1,NULL,NULL,NULL,NULL,NULL,NULL,0,NULL,NULL,NULL,0653020985,1,JAKARTA,PT. ASSAB STEELS INDONESIA,0
185,BM,PT. BINTANGMAS MINOMANUNGGAL,JL. RAYA SULTAN AGUNG KM.27 NO.4 PONDOK UNGU,45,1,NULL,NULL,NULL,1,NULL,NULL,NULL,NULL,NULL,NULL,0,NULL,NULL,NULL,NULL,NULL,NULL,NULL,0
186,CALTESYS,PT. CALTESYS INDONESIA,Puri Niaga  Jl Puri Kencana Blok J- 2 V,14,1,NULL,NULL,NULL,1,NULL,NULL,NULL,NULL,NULL,NULL,0,NULL,NULL,0,NULL,NULL,NULL,NULL,0
187,KAWANLAMA,PT. KAWAN LAMA SEJAHTERA LABORATORARY,Jl. Industri Selatan Blok PP No. 4 Jababeka II - Cikarang,30,1,NULL,NULL,NULL,1,NULL,NULL,NULL,NULL,NULL,NULL,0,NULL,NULL,0,NULL,NULL,NULL,NULL,0
188,AME,PT. ADVAN METAL ENGINEERING,JL. Industri Selatan V blok EE 3 G, Kawasan Industri Jababeka II, Cikarang,30,1,NULL,marketing@advanmetal.com,1,1,NULL,NULL,NULL,021 8984 2791/75,021 8984 2792,NULL,0,NULL,NULL,0,1048114807,9,JAKARTA,PT. ADVAN METAL ENGINEERING,0
189,PN,CV. PRIMA NUSANTARA,Kp. Pedurenan No.05 RT 03 / RW 01 - Kel.Jatiluhur Kec.Jatias,30,0,NULL,NULL,NULL,1,NULL,NULL,NULL,021 37776220 , 081319375595,NULL,Bpk Firman,0,NULL,NULL,0,NULL,NULL,NULL,NULL,0
190,AMT,PT. AMCO MULTITECH,Jl. Bharata Galuh Mas Raya - Ruko Green Village Blok O1 No.6  RT 013 / 004  Ds.Sukaluyu  Kec.Teluk Jambe Timur - Karawang,20,1,NULL,upi.amcomultitech@gmail.com,0,1,NULL,NULL,NULL,0267 8457537,0267 8457440,Ibu Upi,0,NULL,NULL,0,1320006553284,12,JAKARTA,AMCO MULTITECH,0
191,CSM,PT. CAHAYA SUKSES MANDIRI,Kaw. Industri Jababeka II TBKCikarang Industrial Estate T.O.B Blok HH-6,60,1,NULL,NULL,NULL,1,NULL,NULL,NULL,NULL,NULL,Bpk. Willy,0,NULL,NULL,0,8760180808,1,JAKARTA,PT. CAHAYA SUKSES MANDIRI,0
193,DEPO,PT. DEPOTEKNIK DUTA PERKAKAS,KOMPLEK GLODOK JAYA NO. 82 JAKARTA,30,1,NULL,NULL,NULL,1,NULL,NULL,NULL,021 6255333,021 6599288,Bp. Akiat,0,NULL,NULL,0,1943007920,1,PANGERAN JAYAKARTA,PT. DEPOTEKNIK DUTA PERKAKAS,0
194,YJI,PT. Y-JHIN INDUSTRY (X),Paragon Business Park Blok A-88 EE/FF Lippo Cikarang,30,1,NULL,NULL,NULL,1,NULL,NULL,NULL,021 29093188,02129093188,Bp. Sigit,0,NULL,NULL,0,NULL,NULL,NULL,NULL,0
195,ATI,PT. AIR TECHNO INTERNATIONAL,JL. Tidar 2 / 2 Lippo Cikarang Bekasi,30,1,NULL,NULL,NULL,1,NULL,NULL,NULL,021 88314050,021 89904877,Bp. Ruben,0,NULL,NULL,0,NULL,NULL,NULL,NULL,0
196,RST,PT. RUKUN SEJAHTERA TEKNIK,Jl. Hayam Wuruk, Komplek Ruko Glodok Jaya No.80 - 81 & 87  Jakarta 11180,30,1,NULL,NULL,0,1,NULL,NULL,NULL,021 6281615 , 021 6599250,021 6265559,Bpk. Lucas,0,NULL,NULL,0,000074531252,21,KUNINGAN,PT. RUKUN SEJAHTERA TEKNIK,0
197,NP,PT. NIRMANA PELANGI,Jl. Lapan Raya No. 9B 012/001  Kel.Pekayon  Kec.Pasar Rebo  Jakarta Timur,30,0,NULL,NULL,0,1,NULL,NULL,NULL,021 29823383,021 29823383,Bpk Herman,0,NULL,NULL,0,NULL,NULL,NULL,NULL,0
198,CITO,RS. CITO KARAWANG,Jalan Arteri Toll Karawang Barat - Teluk Jambe,0,1,NULL,NULL,NULL,1,NULL,NULL,NULL,0267 414245,0267 414306,Bp. Simbolon Freddy,0,NULL,NULL,0,NULL,NULL,NULL,NULL,0
199,DELIMAASIH,RS. DELIMA ASIH,JL. WIRASABA NO. 54 JOHAR KARAWANG,0,0,NULL,NULL,NULL,1,NULL,NULL,NULL,0267 403073,0267 405598,Ibu Sri,0,NULL,NULL,0,NULL,NULL,NULL,NULL,0
200,ASP,PT. ABADI SURYA PERKASA,Ruko Taman Dutamas  Blok C1 C No.2  Angke Jelambar  Jakarta 11460,30,1,NULL,NULL,0,1,NULL,NULL,NULL,021 5676554,021 5676042,Bpk Mustofa,0,NULL,NULL,0,0505003511,15,MENARA IMPERIUM,PT. ABADI SURYA PERKASA,0
201,BAYUKARTA,RS. BAYUKARTA,Jl. Kertabumi No. 44  Karawang,0,0,NULL,NULL,0,1,NULL,NULL,NULL,0267 401817,0267 401818,Bp. Entis,0,NULL,NULL,0,1320099024821,12,KARAWANG,BRS GK PASUNDAN,0
202,CHJ,CV. CITRA HARAPAN JAYA,Jl. Mangga Dua Abdad No.1 - Rukan Mangga Dua Elok Blok C12 , Jakarta Pusat 10730,30,1,NULL,NULL,0,1,NULL,NULL,NULL,021 6250150 / 021 6250149,021 6250148 / 021 6251186,Ibu Novi,0,NULL,NULL,0,1948021616,1,JAKARTA,CV. CITRA HARAPAN JAYA,0
203,KBT,CV. KARYA BERSAMA TEKNIK,JL.Inspeksi Kali Malang Jembatan III Tambun Bekasi,30,0,NULL,NULL,0,1,NULL,NULL,NULL,021 32338389, 087877493074,021 82650167, 021 8229005, 021 82650167,Bp. Habidin,0,NULL,NULL,0,5780353033,1,BEKASI,HABIDIN,0
204,ASTRAI,PT. ASTRA INTERNATIONAL Tbk - Toyota Bekasi Barat Branch,Jl. Siliwangi RT. 003 / 04 Sepanjang Jaya  Rawa Lumbu Bekasi 17114,NULL,0,NULL,NULL,NULL,1,NULL,NULL,NULL,021 8242 2000,021 820 6404,Bp. Arief,0,NULL,NULL,0,0933023033,1,KARAWANG,PT. ASTRA INTERNATIONAL,0
205,URS,PT. URS  SERVICE INDONESIA,Rukan Graha Kencana Blok BE Jl. Raya Perjuangan No. 88 Kebun Jeruk  Jakarta 11530,0,1,NULL,NULL,NULL,1,NULL,NULL,NULL,021 53660660,021 53613750,Bp. Ferry,0,NULL,NULL,0,NULL,NULL,NULL,NULL,0
206,KBM,CV. KARYA BARU MANDIIRI,Jl. Patriot No. 32 Kamp Dua ( Kranji ) Bekasi Barat,30,1,NULL,NULL,0,1,NULL,NULL,NULL,021 88954566,021 88954566,Bp. Budi,0,NULL,NULL,0,NULL,NULL,NULL,NULL,0
207,AJP,PT. AGUNG JAYA PRANA,JL. Beruang Raya Blok A4/33 Jababeka Cikarang Baru,30,1,NULL,NULL,0,1,NULL,NULL,NULL,021 89843447,021 29471013,Bp. Abbas,0,NULL,NULL,0,1560007264957,12,JAKARTA,PT. AGUNG JAYA PRANA,0
208,CMPFA,CMPFA - Universitas Indonesia,Fakultas Teknik Universtas Indonesia, Kampus Baru UI,NULL,1,NULL,NULL,NULL,1,NULL,NULL,NULL,NULL,NULL,NULL,0,NULL,NULL,0,NULL,NULL,NULL,NULL,0
209,TTI,PT. TOYOTA TSUSHO INDONESIA,Jl.Irian V  Blok KK-8  Kawasan Industri MM2100 , Cikarang Barat - Bekasi 17520,45,1,NULL,NULL,0,1,NULL,NULL,NULL,021 89982801,021 89982788,Ibu Riya,0,NULL,NULL,0,665075033,4,JAKARTA,PT. TOYOTA TSUSHO INDONESIA,0
210,UNGGUL,PT. UNGGUL SEMESTA,Jl. Akasia II AE 3-5-6 Delta Silicon Park Kawasan Industri  Lippo Cikarang,30,1,NULL,NULL,NULL,1,NULL,NULL,NULL,021 8973731 - 35,021 8973736 / 8990 6059,Bp. Winoto,0,NULL,NULL,0,0701180615,16,JAKARTA,PT. UNGGUL SEMESTA,0
211,TMI,PT. TECHNO METAL INDUSTRY,JL. JABABEKA VIB BLOK J7-D, CIKARANG,30,1,NULL,NULL,NULL,1,NULL,NULL,NULL,NULL,NULL,Bpk. Setiono,0,NULL,NULL,0,NULL,NULL,NULL,NULL,0
212,STI,PT. SECO TOOLS INDONESIA,Gedung cawang Kencana 6th FloorSuite 605 Kav.22 Jakarta Timur,60,1,NULL,NULL,NULL,1,NULL,NULL,NULL,NULL,NULL,NULL,0,NULL,NULL,0,0107296018,8,JAKARTA,PT. SECO TOOLS INDONESIA,0
213,ASI,PT. ADYAWINSA STAMPING INDUSTRIES,JL. Surotokunto no 109, Karwang,60,1,NULL,NULL,0,1,NULL,NULL,NULL,0267404555,0267404544,Bpk. Mino,0,NULL,NULL,0,NULL,NULL,NULL,NULL,0
214,TA,CV. TIRTA ASTRO,Jl. Raya Baru Sentul Bogor - Indonesia,30,1,NULL,NULL,NULL,1,NULL,NULL,NULL,021 87925878/ 081381040888,021 87925879,Ibu Lenny,0,NULL,NULL,0,0866666789,1,KARAWANG,CV. TIRTA ASTRO,0
215,KSJ,PT. KOMANDO SIJALAK,Apartemen Taman Rasuna Tower 15 LDB, KT01,NULL,1,03.315.220.8-018.000,NULL,1,0,NULL,NULL,NULL,NULL,NULL,NULL,0,NULL,NULL,0,NULL,NULL,NULL,NULL,0
