577,ULINDO,PT ULINDO CITRA BERSAMA,Ciketing Rawamulya No. 08 Rt 01-03 Kel. Mustikajaya Kota Bekasi,14,1,NULL,NULL,0,1,NULL,NULL,NULL,021 29081973,02129081973,Bpk. Daulat,0,NULL,NULL,NULL,1560010459206,12,BEKASI,PT. ULINDO CITRA BERSAMA,0
578,ACC IND,PT ACCRETECH INDONESIA,Rukan Cikarang Square Blok D No. 68 Jl Raya Cikarang - Cibarusah KM40 No. 1 Cikarang Selatan - Bekasi 17530,0,1,NULL,NULL,0,1,NULL,NULL,NULL,021 2961 2375,021 2961 2376,Mr. Azhad Dinsi,0,NULL,NULL,NULL,3188080151,14,JAKARTA,PT. ACCRETECH INDONESIA,0
579,NA,PT NUANSA AGUNG,Jl Matland Transyogi Ruko PTM II No. 31 Cileungsi - Bogor 16820,30,1,NULL,NULL,0,1,NULL,NULL,NULL,(021) 8248 1611, (021) 8248 1609,(021) 8248 1612,Ibu Iis,0,NULL,NULL,NULL,1330012873303,12,CIBUBUR,PT. NUANSA AGUNG,0
580,SSI,PT. SAITAMA STAMPING INDONESIA,Jl. Permata Raya Lot. C-3A, Karawang Industri KIIC Karawang 41361, Jawa Barat - Indonesia,30,1,NULL,NULL,0,1,NULL,NULL,NULL,(021) 8901505 - 8901506, 89114800 / (0267) 646179,(021) 89114801,NULL,0,NULL,NULL,NULL,665107955,4,JAKARTA,PT. SAITAMA STAMPING INDONESIA,0
581,SAM,PT SINAR AGUNG MARUTETSU,Kp Serang  RT 002/001  Cikarang Selatan - Bekasi,30,1,NULL,sinaragungmarutetsu@gmail.com,0,1,NULL,NULL,NULL,+6221 89677650,+6221 89677584,Bpk H Kosidin,0,NULL,NULL,NULL,0357834702,3,Rawamangun,PT. Sinar Agung Marutetsu,0
582,IRHAM,CV IRHAM MUGHNII,Jl. Industri Cikarang Kp. Sempu Darussalam Cikarang Bekasi 17530,30,1,NULL,NULL,0,1,NULL,NULL,NULL,082299759082,NULL,Sony Amrullah,0,NULL,NULL,NULL,NULL,NULL,NULL,NULL,0
583,BLGL,PT. BEST LINK GLOBAL LOGISTICS,Perkantoran Pulomas Satu Jl. Jend. A. Yani No.2 (Building I),0,0,NULL,NULL,NULL,1,NULL,NULL,NULL,NULL,NULL,NULL,0,NULL,NULL,NULL,NULL,NULL,NULL,NULL,0
584,SARITECH,PT SARITECH PRATAMA MANDRI,Villa Nusa Indah II, Blok GG No. 11 Jati Asih - Bekasi,14,1,NULL,habidinkbt@yahoo.com,NULL,1,NULL,NULL,NULL,021 8246545, 087877493074,021 82650167, 021 8229005,Bpk. Habidin,0,NULL,NULL,NULL,0147193324,3,BEKASI,PT. SARITECH PRATAMA MANDIRI,0
585,MMP,MACHINING MANDIRI PRATAMA,JL. Jababeka XVII B Blok U No. 35-C,Kawasan Industri Cikarang Desa Karang Baru, Kec Cikarang Utara, Kab Bekasi.,30,1,NULL,NULL,0,1,NULL,NULL,NULL,021-89110616,021-8935461,Mr. Ilham,0,NULL,NULL,NULL,NULL,NULL,NULL,NULL,0
586,TSP,PT TANOMI SUKSES PRECISION,Komplek Alhambra Blok GA No. 47 Kota Deltamas Cikarang Pusat - Bekasi 17530,14,1,NULL,NULL,0,1,NULL,NULL,NULL,021 8911 8979,021 89118976,Bpk Budi Miharja,0,NULL,NULL,NULL,8730189444,1,JABABEKA,PT. Tanomi Sukses Precision,0
587,Iwatani,Iwatani Gas and Machinery (Thailand) Ltd.,323 United Center Building, 29th Floor, Room No. 2904. Silom Road, Silom, Bangrak, Bangkok 10500,NULL,0,NULL,manit@iwatani.co.th,0,1,NULL,NULL,NULL,NULL,NULL,Mr. Manit Visavatanapong,0,NULL,NULL,NULL,NULL,NULL,NULL,NULL,0
588,CHINFONG,PT CHIN FONG INDONESIA,Komp. Rukan Gading Kirana Blok  A10 No. 19 Jl Gading Kirana Timur IX, Kelapa Gading Jakarta Utara 14240,14,1,NULL,NULL,NULL,1,NULL,NULL,NULL,021450 7422 / 021 4584 4099,021 4584 4197,Ibu Eriany,0,NULL,NULL,NULL,1027336191,9,JAKARTA,PT. CHIN FONG INDONESIA,0
589,TGL,PT. TRIMITRA GLOBAL LOGISTIC,Jl. Mangga Besar VIII No. 22 B Tamansari, Jakarta Barat, Indonesia 11150,0,1,NULL,NULL,NULL,1,NULL,NULL,NULL,021 62305282,021 62305911,NULL,0,NULL,NULL,NULL,1150000388399
,12,NULL,NULL,0
590,MARUKA,PT MARUKA INDONESIA,Sentra Niaga Kalimalang Blok A7 No. 5-6 Jl A. Yani, Margayaja, Bekasi Selatan, Kota Bekasi,30,1,NULL,NULL,0,1,NULL,NULL,NULL,021 8891611,021 885118,Mr. Ito Masuo,0,NULL,NULL,NULL,01032530008,17,JAKARTA,PT. MARUKA INDONESIA,0
591,TOSAMA,PT TOSAMA ABADI,Jl. Masjid At-Taqwa No. 29, Desa Nagrak, Gunung Putri - Bogor,15,1,NULL,NULL,NULL,1,NULL,NULL,NULL,021 8249 0840,021 8249 1109,Bpk. T. Arifien,0,NULL,NULL,NULL,NULL,NULL,NULL,NULL,0
592,IPM,PT INDONESIA PUTRA MAKMUR,Jl. Ulujami Raya No. 2B RT 002/002 Kel. Pesanggrahan Kec. Pesanggrahan Kota Administrasi Jakarta Selatan,30,1,NULL,NULL,0,1,NULL,NULL,NULL,021 7388 3222,021 7388 3222,Pak Yohanes Reston,0,NULL,NULL,NULL,0833337707,1,JAKARTA,PT. INDONESIA PUTRA MAKMUR,0
593,SJT,PT. SUMBER JAYA TEKNIK,JL. MH Thamruin Ruko Roxy Blok C No. 11, Lippo Cikarang, Bekasi.,30,1,NULL,NULL,0,1,NULL,NULL,NULL,021-89906862,021-89900852,Ms. Ana,0,NULL,NULL,NULL,5220304398,1,CIKARANG,PT. SUMBERTAMA JAYA TEKNIK,0
594,HARSCO,PT HARSCO NUGRAHA,Jl. P. Jayakarta 117 Blok C-5 Jakarta 10730,30,1,NULL,NULL,0,1,NULL,NULL,NULL,021 624 1011,021 624 8060,Bpk. Eka Setiadi,0,NULL,NULL,NULL,1683083678,1,JAKARTA,PT. HARSCO NUGRAHA,0
595,GLOBAL,CV. GLOBAL TECHNIC INDONESIA,Jl Raya Imam Bonjol Ruko Telaga Pesona L01/9 Telaga Sakinah Cikarang Barat - Bekasi,14,1,NULL,NULL,NULL,1,NULL,NULL,NULL,081548487078,-,Bpk. Susilo,0,NULL,NULL,NULL,1560002002071,12,CIKARANG,CV. GLOBAL TECHNIC INDONESIA,0
597,MMP,PT METALINDO MULIA PRATAMA,Komp. Ruko Mega Surya No.16Q (Seberang CTC).  Jl, Raya Cibarusah, Cikarang Selatan, Bekasi 17530,14,1,NULL,NULL,0,1,NULL,NULL,NULL,(021) 8990 5175 / 76,(021) 8967 7160,Mr. Agus Masruri,0,NULL,NULL,NULL,5220394800,1,JAKARTA,PT. METALINDO MULIA PRATAMA,0
598,SK,Sentra Kantor,Jl. Mampang Prapatan VIII No.18A  Mampang, Jakarta Selatan,0,0,NULL,sentrakantor@yahoo.com,0,1,NULL,NULL,NULL,+6221 7990440,+6221 7990006,Mrs Pratiwi  ( +6282213810705 ),0,NULL,NULL,NULL,NULL,NULL,NULL,NULL,0
599,DUTAFLOW,PT DUTAFLOW HIDROLIK,Jl Daan Mogot KM 3, Rukan Green Garden Blok Z-2 No. 68 Kedoya Utara Kebon Jeruk Jak-Bar - 11520,14,1,NULL,NULL,0,1,NULL,NULL,NULL,021 5815236, 5814173, 5835 7261, 58357273,021 5815235, 58357393,Pak Supriyanto,0,NULL,NULL,NULL,2533001068,1,JAKARTA,PT. DUTAFLOW HIDROLIK,0
600,SPS,PT. SUPRA PASIFIK SARANA,Rukan Sunter Permai Blok B-20, JL. Danau Sunter Utara, jakarta,30,1,NULL,NULL,0,1,NULL,NULL,NULL,021-6512350,021-6511484,Mr. Andri,0,NULL,NULL,NULL,NULL,NULL,NULL,NULL,0
601,EZRA,PT EZRA CATINDO PERKASA,Komp Mitra Bekasi Jl Juanda151 D15 No. 15 RT 001 RW 001 Duren Jaya Bekasi Timur Kota Bekasi,30,1,NULL,NULL,0,1,NULL,NULL,NULL,081289642414,NULL,Pak Jeffry,0,NULL,NULL,NULL,0660570713,1,JAKARTA,JEFFRY,0
602,APP,PT. ABDI PUTRA PRATAMA,Jl. Bacang Raya No.127  RT/RW 002/004  Pekayon Jaya - Bekasi Selatan , Kota Bekasi 17148,30,1,NULL,pt.abdiputrapratama@gmail.com,0,1,NULL,NULL,NULL,+6221 82732077,NULL,Bpk Suwandi  ( +6287777620244 ),0,NULL,NULL,NULL,NULL,NULL,NULL,NULL,0
603,HPM Partners,HPM & Partners,Jl. Tanjung Karang Kav. 3-4A, Dukuh atas, Jakarta 10230, Indonesia,30,0,02.882.239.3-072.000,hpmlawfirm@gmail.com,0,1,NULL,NULL,NULL,02131902872,02131902874,NULL,0,NULL,NULL,NULL,010490011000097,13,JAKARTA,LAW FIRM HPM & PARTNER,0
604,AR,Bengkel AR MOTOR,Perum Citra Kebun Mas ( CKM )  Blok  L7 No.22  Ds.Bengle  Majalaya  - Karawang,30,0,NULL,anton_529823@yahoo.com,0,1,NULL,NULL,NULL,+6287887264510  ||  +6287882770223,NULL,Bpk Anton,0,NULL,NULL,NULL,1219985793,16,JAKARTA,RUBIYO,0
605,DOWA,PT. DOWA THERMOTECH INDONESIA,Jl. Maligi VI Lot G-4, Kawasan Industri KIIC, Karawang 41361,45,1,NULL,sofyan@dowa-tht.co.id,NULL,1,NULL,NULL,NULL,021-89114346,021-89114348,Bp. Sofyan,0,NULL,NULL,NULL,NULL,NULL,NULL,NULL,0
606,TBS,PT TIRTA BUMI SENTOSA,Jl Arteri Mangga Dua Raya Komplex Ruko Textile Blok E1 No. 1 Jakarta Utara Indonesia,0,1,NULL,NULL,0,1,NULL,NULL,NULL,021 6014 278, 79, 80,021 6015 249,Bpk Djoni,0,NULL,NULL,NULL,NULL,NULL,NULL,NULL,0
607,BTJ,Berkah Teknika Jaya,Jl Flamboyan No. 29 Rempoa Tanggerang,14,0,NULL,NULL,0,1,NULL,NULL,NULL,021 9495 1413,021 7340 624,Bu Rina,0,NULL,NULL,NULL,NULL,NULL,NULL,NULL,0
608,AAP,PT. ADIPERKASA ANUGRAH PRATAMA,Jl. Pajajaran No. 10 RT 001-007 Jatiuwung Tangerang,30,0,02.869.975.4-402.000,NULL,NULL,1,NULL,NULL,NULL,021 5917322,021 5917404,NULL,0,NULL,NULL,NULL,1550005885887,12,TANGERANG,PT. ADIPERKASA ANUGRAH PRATAMA,0
609,PTE,PT. PRIMA TEKNIK MANDIRI,JL. Pluit Selatan I No 43, Jakarta Utara,30,1,NULL,NULL,0,1,NULL,NULL,NULL,0216603986,0216602591,MS. RANY LIE,0,NULL,NULL,NULL,NULL,NULL,NULL,NULL,0
610,ADIJAYA,CV. ADI JAYA TEKNIK,Jl. Kresek Raya No. 110 Kali Deres Jakarta Barat,14,1,NULL,adi_jayatehnik@yahoo.com,NULL,1,NULL,NULL,NULL,021 29030231, 021 29030232,021 29030232,Bpk Adi,0,NULL,NULL,NULL,2777284777,1,JAKARTA,CV. ADI JAYA TEHNIK,0
611,BAT,PT. BAHANA AKURASI TEKNOLOGI,JL. Raya Kalimalang No. 57, Desa Hegarmukti, Cikarang Pusat, Bekasi,30,1,NULL,NULL,0,1,NULL,NULL,NULL,021-29469522,02129469518,Mr. Priamus,0,NULL,NULL,NULL,572800001800,18,PULO GADUNG,PT. BAHANA AKURASI TEKNOLOGI,0
612,CBC,PT. CBC PRIMA,Gedung Midplaza II Lt. 12, Jl. Jend. Sudirman Kav.10-11, Karet Tengsin, Tanah Abang. Jakarta Pusat 10220,30,1,NULL,odji@cbcprima.co.id,NULL,1,NULL,NULL,NULL,021-570 7590,021-570 7591,Mr. Fachrurodji,0,NULL,NULL,NULL,NULL,NULL,NULL,NULL,0
613,MHB,PT MHB INDONESIA,Jalan Raya Diklat Pemda No.88 Kp.Dukuh Pinang Kel.Bojongnangka, Kelapa Dua- Tangerang, Banten 15821,30,1,NULL,NULL,0,1,NULL,NULL,NULL,(021)29871377,(021)29871381,Pak Felix,0,NULL,NULL,NULL,1190088880990,12,JAKARTA,PT MHB INDONESIA,0
614,OSIDIA,PT OSIDIA SERVICE INDUSTRY,Jl. Raya Bekasi KM. 23,5 No. 79, Cakung - Jakarta 13910,NULL,1,NULL,NULL,NULL,1,NULL,NULL,NULL,(021) 460 3429 - 30,(021) 460 0866,NULL,0,NULL,NULL,NULL,NULL,NULL,NULL,NULL,0
615,HPM,PT. Honda Prospect Motor,Jl. Mitra Utara II (KIM) Desa Parungmulya, Kec. Ciampel - Karawang 41361,30,1,NULL,eko_taskuro@hpm.co.id,1,0,NULL,NULL,NULL,0267-440777,NULL,Mr. Eko Taskuro,0,NULL,NULL,NULL,NULL,NULL,NULL,NULL,0
616,JODABO,PT JODABO SUKSES,Kawasan Industri Delta Silikon V Blok G5-06A, Cikarang,30,1,NULL,Jodabo@cbn.net.id,NULL,1,NULL,NULL,NULL,021-89911348, 42889982,021-89911350, 42889981,Pak Andri Adha,0,NULL,NULL,NULL,NULL,NULL,NULL,NULL,0
617,CIPTA,PT. CIPTA TOOLSINDO MANDIRI,Jl. Inspeksi Kali Malang No.55, Tegal Danas, Jayamukti Cikarang Pusat - Bekasi,NULL,1,NULL,NULL,NULL,1,NULL,NULL,NULL,(021) 29469557,(021) 29469490,NULL,0,NULL,NULL,NULL,NULL,NULL,NULL,NULL,0
618,AP,CV ASIA PERDANA,Jl Raya Klari Dsn Kopo rt 007 w002 Kec. Klari Kab. Karawang,30,1,NULL,NULL,0,1,NULL,NULL,NULL,0882-1141-3870,NULL,Bpk. Ihat Pahitah,0,NULL,NULL,NULL,NULL,NULL,NULL,NULL,0
619,SR,SUMBER REZEKI,Perum Taman Ratu Blok A/4 No. 7 Jakarta,14,0,NULL,NULL,0,1,NULL,NULL,NULL,0819-0598-9595,NULL,Bpk. Rendy Taswin,0,NULL,NULL,NULL,4661263088,1,JAKARTA,RENDY TASWIN TJOENG,0
620,PMI,PT. PRESS MOLD INDONESIA,Jl. Jababeka II Blok CC No. 18A. Pasir Gombong, Cikarang Utara - Bekasi, Indonesia,NULL,1,NULL,NULL,NULL,1,NULL,NULL,NULL,08121355809,NULL,NULL,0,NULL,NULL,NULL,6880238866,1,JAKARTA,PT. PRESS MOLD INDONESIA,0
621,BIGL,PT BUKIT INTAN GEMILANG LESTARI,Jl Pool PPD, Pesing Poglar No. 11 Gudang Prima Center I, Blok E1 No.1 Jakarta Barat 11710,30,1,NULL,NULL,0,1,NULL,NULL,NULL,021 54378020-23,021 54367445,Bpk. Surya Bakti,0,NULL,NULL,NULL,NULL,NULL,NULL,NULL,0
622,MMJ,MEKAR MAS JAYA,Pertokoan Glodok Jaya Lt II Blok C No. 39 Jakarta,NULL,1,NULL,NULL,NULL,1,NULL,NULL,NULL,(021) 62309132,(021) 62309133,NULL,0,NULL,NULL,NULL,NULL,NULL,NULL,NULL,0
623,EVI,PT. ENOCCO VITALTECHNO INDONESIA,Jl. Raya Narogong KM 15,5 Pangkalan 7 Limusnunggal-Bogor,14,1,NULL,enoccovital@gmail.com,0,1,NULL,NULL,NULL,021-2946-4232,021 2922-2810,Ibu Suci A Rukma,0,NULL,NULL,NULL,NULL,NULL,NULL,NULL,0
624,KPK,PT. KLARI PUTRA KREASINDO,Jl. Raya Klari No.10 Klari-Karawang,7,0,NULL,NULL,0,1,NULL,NULL,NULL,0267438007,0267438007,Yanti Yulianti,0,NULL,NULL,NULL,001921486,3,KOSAMBI,PT. KLARI PUTRA KREASINDO,0
625,MITUTOYO,PT MITUTOYO INDONESIA,Jl Sriwijaya No. 26 Desa Cibatu Kec Cikarang Selatan Kab. Bekasi 17530,30,1,NULL,NULL,0,1,NULL,NULL,NULL,021- 2962 8600,021- 2962 8604,Bpk. Tri Yogo Prasetiyo,0,NULL,NULL,NULL,NULL,NULL,NULL,NULL,0
626,RLI,PT Raja Listrik Indonesia,Ruko Sutera Niaga 1 No.22   Alam Sutera - Tangerang 15325,30,1,NULL,hendry@rajalistrik.co.id,0,1,NULL,NULL,NULL,+6221 53129556  ||  +62895325042 , +6285782208867,NULL,Bpk Hendry,0,NULL,NULL,NULL,NULL,NULL,NULL,NULL,0
627,BUANA,CV BUANA TUNGGUL,Jalan Merak 9A, Blok K3/49 Cikarang Baru - Bekasi,30,1,NULL,NULL,0,1,NULL,NULL,NULL,021 8984 1074,021 8984 1073,Bpk Hilman,0,NULL,NULL,NULL,NULL,NULL,NULL,NULL,0
628,SWR,SARANA WIRA REKSA,Jl. Cendana Raya Blok F 25 - 20A Delta Silicon III - Cikarang,NULL,1,NULL,NULL,NULL,1,NULL,NULL,NULL,(021) 29689503/ 29689504,(021) 29689505,NULL,0,NULL,NULL,NULL,NULL,NULL,NULL,NULL,0
629,MMI,PT. MASUTA METAL INDONESIA,Jl. Telesonic No. 10 Blok B.2/RT 001 RW 001, Kadujaya, Kab. Tangerang,30,1,NULL,NULL,NULL,1,NULL,NULL,NULL,NULL,NULL,NULL,0,NULL,NULL,NULL,1660066677899,12,JAKARTA,PT. MASUTA METAL INDONESIA,0
630,Pak Sahid,Pak Sahid,Karawang,NULL,1,00.000.000.0-000.000,NULL,1,NULL,NULL,NULL,NULL,NULL,NULL,NULL,0,NULL,NULL,NULL,NULL,NULL,NULL,NULL,0
631,FMS,PT. FAMILINDO MITRA SEJAHTERA,Ejip Plot 5B, Sentra Niaga Square Jababeka II,NULL,1,NULL,NULL,NULL,1,NULL,NULL,NULL,(021) 29470023,(021) 29470023,NULL,0,NULL,NULL,NULL,NULL,NULL,NULL,NULL,0
632,ACT,AUTO CIPTA TEKNIK,Jl. Anggur 1 Blok XF No. 15 Harapan Indah - Bekasi,NULL,1,NULL,NULL,NULL,1,NULL,NULL,NULL,081212341661,081285059387,NULL,0,NULL,NULL,NULL,6630366133,1,JAKARTA,VALENTINUS RANRAN,0
633,MORY,PT. MORY INDUSTRIES INDONESIA,Jl. Surya Lestari Kav. I-2G Kutamekar, Ciampel, Karawang 41361 Jawa Barat, Indonesia,30,1,NULL,m.agil@mory.co.id,NULL,1,NULL,NULL,NULL,0267-863-7800,0267-863-7801,Mr. Agil,0,NULL,NULL,NULL,NULL,NULL,NULL,NULL,0
634,VI,PT. Vuteq Indonesia,Jl. cempaka KM 37 RT 003 RW 002 Jati Mulya,0,0,NULL,NULL,NULL,1,NULL,NULL,NULL,NULL,NULL,NULL,0,NULL,NULL,NULL,NULL,NULL,NULL,NULL,0
635,KBU,PT. KARYA BAHANA UNIGAM,JL.PULOMAS RAYA NO.08 PULO GADUNG - JAKARTA TIMUR - DKI JAKARTA RAYA - 13210,NULL,1,01.303.683.5-073.000,NULL,1,1,NULL,NULL,NULL,NULL,NULL,NULL,0,NULL,NULL,NULL,NULL,NULL,NULL,NULL,0
636,MAHKOTA,PT MAHKOTA TIMUR,Jalan Bantar Gebang - Setu No. 311 Bekasi 17151,14,1,NULL,NULL,0,1,NULL,NULL,NULL,021 2908-0265,021 29080264,Pak Rino,0,NULL,NULL,NULL,4503751111,1,JAKARTA,PT. MAHKOTA TIMUR,0
637,SEID,PT. SHARP ELECTRONICS INDONESIA,Jl. Harapan Raya LOT LL 1 & 2 KIIC Sirnabaya Telukjambe Timur Karawang,30,1,NULL,NULL,NULL,1,NULL,NULL,NULL,02678468600,02678468601,NULL,0,NULL,NULL,NULL,NULL,NULL,NULL,NULL,0
638,JBC,JASA BERKAT CATERING,Jl. Aster Raya No. 73, Lembar Hijau Lippo Cikarang, Bekasi,0,0,NULL,andisuprapto.allianz@gmail.com,0,1,NULL,NULL,NULL,02122104483,081283155670,Andi Suprapto,0,NULL,NULL,NULL,1560011773290,12,JAKARTA,ANDI SUPRAPTO,0
639,SYNERGI,CV Synergi Prima,Graha Cikarang Blok C8 No 13 Lemah Abang Jababeka-Cikarang Bekasi,10,1,NULL,NULL,0,1,NULL,NULL,NULL,(021) 89844277, (021) 22108075,(021) 37352960,Ibu Merry S,0,NULL,NULL,NULL,NULL,NULL,NULL,NULL,0
640,YTI,PT. YUSAMASU TECH INDONESIA,Jl. Indusstri Selatan V Blok EE 3 / J, Cikarang - Bekasi,NULL,1,NULL,NULL,NULL,1,NULL,NULL,NULL,(021) 8984 - 1330,(021) 8984 - 1345,NULL,0,NULL,NULL,NULL,0204163271,3,JAKARTA,PT. YUSAMASU TECH INDONESIA,0
641,SEC,SUMMIT ELECTRONIC COMPONENTS CO., LTD.,99 Moo5 Soi Watsrivareenoi, Bangna-Trad Rd, KM 18. Srisajorakaeyai, Bangsaothong, Samutprakarn 10540,0,0,NULL,NULL,0,1,NULL,NULL,NULL,02-3371553-67,02-3371201-2,Khun Chaiyuth,0,NULL,NULL,NULL,NULL,NULL,NULL,NULL,0
642,REP,PT RIKEN Engineering Perkasa,Perum Saung Indah  Blok D5 No.06  Bangle - Majalaya, Karawang,30,1,NULL,riken.engperkasa@gmail.com,0,1,NULL,NULL,NULL,+62267 8402385,+62267 8402385,Mr Waskito,0,NULL,NULL,NULL,NULL,NULL,NULL,NULL,0
643,GT,CV. GALAWISTAMA TEKNIK,Pondok Timur Indah I Blok G No. 312 Tambun Selatan, Bekasi 17515,14,1,NULL,NULL,0,1,NULL,NULL,NULL,021 8260 7454/085103000551,021 8260 7454,Bpk. Bambang Antoro,0,NULL,NULL,NULL,NULL,NULL,NULL,NULL,0
644,SMC,PT. SINAR MUTIARA CAKRABUANA,Komplek Pertokoan Glodok Ruko No. 28 Jl. Hayam Wuruk Kel. Mangga Besar, Taman Sari - Jakarta Barat,30,1,NULL,NULL,0,1,NULL,NULL,NULL,(62-21) 6308 525,(62-21) 6308 425,Bpk. Suryo Prayogo,0,NULL,NULL,NULL,3973024121,1,JAKARTA,PT. SINAR MUTIARA CAKRABUANA,0
645,SGI,PT. SUGINDO INTERNATIONAL,Jl. Harapan VIII Lot LL-16, Kawasan Industi KIIC, Parungmulya, Ciampel, Karawang,NULL,1,02.727.931.4-433.000,NULL,1,0,NULL,NULL,NULL,NULL,NULL,NULL,0,NULL,NULL,NULL,NULL,NULL,NULL,NULL,0
646,BCA,PT BRENSON CITRA ABADI,Ruko Palais De Paris Blok I No. 21 Kota Deltamas Cikarang Pusat,30,1,NULL,rudi@brensoncitraabadi.co.id,0,1,NULL,NULL,NULL,021 22157063,021 22157064,Bpk. Rudi,0,NULL,NULL,NULL,5220387838,1,CIKARANG,PT. BRENSON CITRA ABADI,0
647,RAM,REKATAMA ALAM MANDIRI,Jalan torusan bandongan utara 95 blok D/32B jakarta 1440 indonesia,30,1,NULL,adm2@rekatama.biz,0,1,NULL,NULL,NULL,081288746626, 0878788107578,NULL,Bpk RUDY. H,0,NULL,NULL,NULL,1150000071961,12,JAKARTA,PT. REKATAMA ALAM MANDIRI,0
648,IPT,PT. INTI PERKASA TEKINDO,Kp. Lubang Buaya Sentul RT 3/9 No. 26. Cijengkol, Setu - Bekasi,30,1,NULL,helmi@intiperkasatekindo.com,0,1,NULL,NULL,NULL,021-82611613,021-82611408,Mr. Helmi,0,NULL,NULL,NULL,NULL,NULL,NULL,NULL,0
649,GT,GANDING TOOLSINDO,JL. KRUING II MULTI NIAGA III NO. LIPPO CIKARANG.,NULL,1,NULL,NULL,0,1,NULL,NULL,NULL,085285703547,NULL,WAN M LAZUARDI,0,NULL,NULL,NULL,NULL,NULL,NULL,NULL,0
650,FASTEC,FASTEC,JL. RADEN SALEH NO. 72B KARANG TENGAH-CILEDUG-TANGGERANG,30,1,NULL,NULL,0,1,NULL,NULL,NULL,02173454341,02173454342,YULI AYUDI,0,NULL,NULL,NULL,NULL,NULL,NULL,NULL,0
651,AFTECH,PT AFTECH RAND PERKASA,KAWASAN INDUSTRI JABABEKA II. JL. INDUSTRI SELATAN 1 A, BLOK Nn 3G-H CIKARANG- BEKASI 17530,30,1,NULL,NULL,0,1,NULL,NULL,NULL,0218937080,0218937327,BP IRWAN HATIBU,0,NULL,NULL,NULL,0207020705,3,CIKARANG BARU,PT. AFTECH RAND PERKASA,0
652,POSCO,POSCO,Jl. Permata Raya Lot FF - 3, Kawasan Industri KIIC Karawang 41361 - Jawa Barat.,NULL,1,NULL,NULL,0,1,NULL,NULL,NULL,0622189118989 ,  0622678450110,0622189118899,Bpk. Indra Dwiharto,0,NULL,NULL,NULL,NULL,NULL,NULL,NULL,0
653,SSJ,PT. SAHABAT SLAMET RAHARJA,Jl. Mancong No.268B Kawasan Industri Cibaligo Cimahi-Bandung.,NULL,1,NULL,NULL,0,1,NULL,NULL,NULL,022-6030379,085794477875,Mr. Pudin Mahpudin,0,NULL,NULL,NULL,NULL,NULL,NULL,NULL,0
654,KSM,PT. KOSEN SEIKO MAKMUR,JL. Nemen Jaya Kav.8 No.38 Rt/rw : 006/.018 Pengasinan - Bekasih Timur 17115.,NULL,1,NULL,NULL,0,1,NULL,NULL,NULL,021824239493,02182433376,Mr. Anang,0,NULL,NULL,NULL,NULL,NULL,NULL,NULL,0
655,ACM,PT. ALEY CIPTA METALINDO,Jl. Raya Kav. Hankam No. 03 Rt. 001 Rw 021 Setia Mekar, Tambun Selatan - Bekasi 17510 Jawa Barat,NULL,1,NULL,NULL,0,1,NULL,NULL,NULL,(62-21) 8835 5580,(62-21) 8835 4027,DIANA,0,NULL,NULL,NULL,0663102327,1,JAKARTA,PT. ALEY CIPTA METALINDO,0
656,ACM,ALEY CIPTA METALINDO,Jl. Raya Kav. Hankam No. 03 Rt. 001 Rw 021 Setia Mekar, Tambun Selatan - Bekasi 17510 Jawa Barat,NULL,1,NULL,NULL,0,1,NULL,NULL,NULL,(62-21) 8835 5580,,(62-21) 8835 4027,Mrs  Diana,0,NULL,NULL,NULL,0663102327,1,JAKARTA,PT. ALEY CIPTA METALINDO,0
657,SIWARKA,PT SIWARKA INDONESIA,Jl. Kelapa Kopyor IX Blok CB9 No. 21 Gading Serpong - Tanggerang,30,1,NULL,NULL,NULL,1,NULL,NULL,NULL,(021) 29507083,(021) 29507016,Ibu Noviyanti,0,NULL,NULL,NULL,NULL,NULL,NULL,NULL,0
658,ARTWIRE,PT. ART WIRE,JL. INDUSTRI SELATAN X BLOK EE 11-H CIKARANAG, BEKASI 17550,NULL,1,NULL,NULL,1,1,NULL,NULL,NULL,02189842261,02189842262,Mr. Kholid,0,NULL,NULL,NULL,NULL,NULL,NULL,NULL,0
659,STI,SECO,Jalan cawang kencana building,,NULL,1,NULL,NULL,0,1,NULL,NULL,NULL,02180888122,02180888120,Bpk  Anjar Satrianto,0,NULL,NULL,NULL,NULL,NULL,NULL,NULL,0
660,MJ,PT MITRA JAYAPLAST,Jababeka Divisi II  Blok A No.126 - Cikarang,30,1,NULL,mitrajayaplast0506@gmail.com,0,1,NULL,NULL,NULL,+6221 89833419,+6221 89832272,Mrs Melly / Mr Bimbi  ( +6282111915700 ),0,NULL,NULL,NULL,NULL,NULL,NULL,NULL,0
661,STSP,PT SARANA TRIMITRA SOLUSINDO PRATAMA,Komplek 3 Gudang Blok B27 Jl. Raya Daan Mogot KM 21 Tanggerang 15141,7,1,NULL,NULL,0,1,NULL,NULL,NULL,021 2917 0399,021 2917 0398,Bpk Herwin / Ibu Vania,0,NULL,NULL,NULL,NULL,NULL,NULL,NULL,0
662,CIPTA GUNA,PT CIPTA GUNA INDONESIA,Jl Raya Cipanas Cimahi No. 106 Padaasih Cisarua - Bandung,30,1,NULL,NULL,0,1,NULL,NULL,NULL,(022) 2700749,(022) 2700749,Bpk. Muhammad Wahib,0,NULL,NULL,NULL,NULL,NULL,NULL,NULL,0
663,DLS,PT DACAN LESTARI SEJAHTERA,Jl. Kedoya Duri No. 10C-D Kedoya Selatan Jakarta 11520,30,1,NULL,NULL,0,1,NULL,NULL,NULL,021 5818 311,021 5818 310 - 5800 374,Ibu Sugiarti,0,NULL,NULL,NULL,NULL,NULL,NULL,NULL,0
664,SL Printer,PT STRATA LINE,Jl.Marzuki I No.66 Penggilingan  Cakung  Jatinegara - Jakarta Timur,30,1,NULL,topglobiss@yahoo.com,0,1,NULL,NULL,NULL,+6221 46828534,+6221 4601606,Mr Topo Ragil   (+6281908602640),0,NULL,NULL,NULL,NULL,NULL,NULL,NULL,0
665,HIBEX,PT HIBEX INDONESIA,Jl Jababeka II Blok C18 E Bekasi,30,1,NULL,NULL,0,1,NULL,NULL,NULL,021 8936 920,021 8936 919,Ibu Indri Astuti,0,NULL,NULL,NULL,NULL,NULL,NULL,NULL,0
666,YAMAZEN,PT. YAMAZEN INDONESIA,Jl. Kenari Raya, Delta Silicon 6, Lippo Cikarang 17550,NULL,1,NULL,NULL,0,1,NULL,NULL,NULL,(62-21) 2909 4445,(62-21) 2909 4446,Mr. Agung,0,NULL,NULL,NULL,NULL,NULL,NULL,NULL,0
667,LS,Lentera Safety,Rukan Sentra Niaga Kalimalang Blok B3 No. 14, Jl. Jendral Ahmad Yani, Bekasi 17144 - Indonesia,0,0,NULL,NULL,NULL,1,NULL,NULL,NULL,02129257695,02129257652,NULL,0,NULL,NULL,NULL,NULL,NULL,NULL,NULL,0
668,PMT,PT. PASTEK MITRA TEKNIK,Ruko Porto F 15 Kota Deltamas Cikarang Pusat Bekasi - 17330,NULL,1,NULL,NULL,0,1,NULL,NULL,NULL,021 8997 0193,021 8997 0194,NULL,0,NULL,NULL,NULL,NULL,NULL,NULL,NULL,0
669,HTI,PT. HONDA TRADING INDONESIA,Mid plaza 1 Lt.6 Jl. Jendral Sudirman Kav.10-11 Karet Tengsin Tanah Abang - Jakarta Pusat DKI Jakarta Raya 10220,NULL,1,02.115.759.9-059.000,NULL,1,1,NULL,NULL,NULL,NULL,NULL,NULL,0,NULL,NULL,0,665147228,4,JAKARTA,PT. HONDA TRADING INDONESIA,0
670,DALSE,PT. DAME ALAM SEJAHTERA,Jl. Raya Proklamasi Kp. Kaceot II RT 001/RW 012, kel. tunggak jati, kec. karawang barat,0,0,NULL,NULL,0,1,NULL,NULL,NULL,NULL,NULL,Cecep,0,NULL,NULL,NULL,NULL,NULL,NULL,NULL,0
671,AIS,PT Anugrah Insan Selaras,Center Point Apartment Tower C Floor 12-33  Jl.Ahmad Yani - Bekasi,30,0,NULL,anugrah.insan.selaras@gmail.com,0,1,NULL,NULL,NULL,+6221 22100194,NULL,Bpk Tedi Apandi - +6281223345453,0,NULL,NULL,NULL,1320019992016,12,JAKARTA,PT ANUGRAH INSAN SELARAS,0
672,IBRM,PT Istana Bandung Raya Motor,Jl.Surotokunto No.52, Karawang - Indonesia,0,0,NULL,NULL,0,1,NULL,NULL,NULL,+62267 400860,+62267 416370,Bpk Pat Aryo Hernowo,0,NULL,NULL,NULL,NULL,NULL,NULL,NULL,0
673,MST,PT MUTIARA SAMPURNA TEKNIK,Jl Raya Klari Dusun Kopo Rt 007 Rw 002 Kec. Klari Kab. Karawang,30,0,NULL,NULL,0,1,NULL,NULL,NULL,0812-1867-8434,0812-1867-8434,Pak Budi,0,NULL,NULL,NULL,NULL,NULL,NULL,NULL,0
674,MKS,PT. MITRA KARUNIA SEHATI,Jl. Raya Tegal Danas - Pemda Kota Deltamas No. 2 RT 03/01 Desa Jayamukti Kec. Cikarang Pusat,0,0,NULL,NULL,NULL,1,NULL,NULL,NULL,NULL,NULL,NULL,0,NULL,NULL,NULL,NULL,NULL,NULL,NULL,0
675,IBRM,ISTANA BANDUNG RAYA MOTOR,Cicendo, Bandung,0,0,NULL,NULL,0,1,NULL,NULL,NULL,NULL,NULL,Pat Aryo,0,NULL,NULL,NULL,NULL,NULL,NULL,NULL,0
676,EKN,PT Eskanusa,Harco Mangga Dua  Blok G No.5  Jl.Mangga Dua Raya - Jakarta 10730,30,0,NULL,marketing@eskanusa.com,0,1,NULL,NULL,NULL,+6221 6121021,+6221 6121020,Ibu Riris,0,NULL,NULL,NULL,NULL,NULL,NULL,NULL,0
677,CTT,CV Tunggal Teknik,Jl.Beruang 6 / A3 No.77  Cikarang Baru,30,1,NULL,tunggalteknik.cv@gmail.com,0,1,NULL,NULL,NULL,+6221 89835189,+6221 89834846,Bpk Irawan,0,NULL,NULL,NULL,NULL,NULL,NULL,NULL,0
678,MMS,PT Mitra Mina San,Perum Telaga Harapan Blok K6/1 RT 005/018  Telaga Murni - Cikarang Barat , Bekasi 17530,30,1,NULL,mitraminasan@gmail.com,0,1,NULL,NULL,NULL,+6221 29372131,+6221 29372131,Bpk Iwan Purwanto,0,NULL,NULL,NULL,NULL,NULL,NULL,NULL,0
679,ANTEK,CV. ANUGERAH TEKNIKTAMA,Jl. Raya Meruya Ilir, Taman Kebon Jeruk Blok A4/25, Jakarta 11650 - Indonesia,30,1,NULL,NULL,0,1,NULL,NULL,NULL,+62 21 5859770, 5859771, 5845782,+6121 5850052,Bpk. Utsman Farahidi,0,NULL,NULL,NULL,NULL,NULL,NULL,NULL,0
680,AITC,Toko ALDO IT Center,Mall Techno Mart   LT Blok C No.37  -  Galuh Mas, Karawang,14,0,NULL,aldo_print_45@yahoo.com,0,1,NULL,NULL,NULL,+6281282850179,NULL,Bpk Mukhlisin,0,NULL,NULL,NULL,NULL,NULL,NULL,NULL,0
681,IPLOG,PT. IP LOGISTICS INDONESIA,Ujung Menteng Business Center Blok J-8. Jl. Sri Sultan Hamengkubuwono IX, KM. 25 - Cakung,0,1,NULL,mkt1@iplogistics-indo.net,0,1,NULL,NULL,NULL,021-4608699,NULL,Ibu Indri,0,NULL,NULL,NULL,0055768401,3,JAKARTA,PT. IP LOGISTICS INDONESIA,0
682,GPS,PT Global Prima Sakti,Gedung Duta Group  Jl.Taman Lebak Bulus Raya  Blok L No.15  Lebak Bulus, Cilandak - Jakarta Selatan 12440,30,1,NULL,agus@globalprimasakti.com,0,1,NULL,NULL,NULL,+6221 75816504,+6221 75915581,Mr Agus Nurcholis,0,NULL,NULL,NULL,NULL,NULL,NULL,NULL,0
683,AIT,PT. Aneka Infokom Tekindo,Jl. A M Sangaji No.22B , Jakarta 10130,30,1,NULL,yoza@aneka-infokom.co.id,0,1,NULL,NULL,NULL,+6221 6347108,+6221 6347119 - 6347121,Bpk Yoza Oktavenus,0,NULL,NULL,NULL,NULL,NULL,NULL,NULL,0
684,KORINDO,CV. SAMUDRA KORINDO,Jl. Kembangan Baru No. 70-71, Kembangan Utara, Jakarta Barat,0,1,NULL,NULL,0,1,NULL,NULL,NULL,021-5835 2225,021-5835 2226,Bpk Jamin Ginting Suteja,0,NULL,NULL,NULL,NULL,NULL,NULL,NULL,0
685,DI,Direktor Indonesia,Perumahan Grand Permata Residence Blok L6 No.12 Bekasi Utara,30,0,NULL,NULL,0,1,NULL,NULL,NULL,0813 8685 9110,NULL,Pak Hilman,0,NULL,NULL,NULL,8060133353,1,JAKARTA,HILMAN,0
686,ADW,PT. ADYAWINSA DINAMIKA,JL. JABABEKA IV SFB BLOK V/81B CIKARANG INDUSTRIAL ESTATE, BEKASI,30,1,01.603.428.2-431.000,NULL,0,1,NULL,NULL,NULL,NULL,NULL,NULL,0,NULL,NULL,NULL,NULL,NULL,NULL,NULL,0
687,SRD,SUMMIT R&D CENTER CO.,LTD,32-33 Moo17 Bangna-trad Rd.Bangpleeyai, Bangplee,samutprakarn10540,NULL,1,NULL,ptr.srdc@summitautogroup.com,NULL,1,NULL,NULL,NULL,(662)338-6000,(662)-3168798,NULL,0,NULL,NULL,NULL,NULL,NULL,NULL,NULL,0
688,PARAMETAL,PT PARAMETAL PERKASA AGUNG,Jl. Irigasi Raya Blok H No.36 Ruko Permata Gardenia, Cikarang Baru, Jababeka II, Cikarang - Bekasi 17530 - Jawa Barat,NULL,1,NULL,sales@parametal.co.id,0,1,NULL,NULL,NULL,021-221 880 43,021-221 880 43,Wasito,0,NULL,NULL,NULL,NULL,NULL,NULL,NULL,0
689,pamindo,PT. PAMINDO TIGA T,Jl. M.H Thamrin KM-7, Tangerang 15000,30,1,NULL,NULL,0,1,NULL,NULL,NULL,021-53122472,021-53122482,Mr. Aris,0,NULL,NULL,NULL,NULL,NULL,NULL,NULL,0
