348,SERVATEK,PT. SERVATEK ANUGERAH EKSAKTA,JL. Raya Setu KM 4.5 No. 27 Desa Telajung, Cibitung, Bekasi,30,1,NULL,NULL,0,1,NULL,NULL,NULL,02182609740,NULL,Bpk. Jadi,0,NULL,NULL,NULL,2660100119000,7,BEKASI,PT. SERVATEK ANUGERAH EKSAKTA,0
349,AE,PT. ADRINUSA ESATAMA,Setra Niaga 5 Blok 1 No. 3 Kota Harapan Indah - Bekasi 17214,30,1,NULL,NULL,NULL,1,NULL,NULL,NULL,021 29477438,021 29477439,Bp. NURSUHADI,0,NULL,NULL,NULL,NULL,NULL,NULL,NULL,0
350,UP,CV. UNIVERSAL PACKAGING,Komplek Industry Ruko Benhill No. 170 - Cikarang  17550,30,1,NULL,budi.universal@gmail.com,NULL,1,NULL,NULL,NULL,021 89835205,021 89831567,Bpk Budi Setyono || +628159795905,0,NULL,NULL,NULL,1560004427888,12,JABABEKA,CV. UNIVERSAL PACKAGING,0
351,WOOIN,PT. WOO IN,Kawasan Industri MM2100 Blok MM-3-1 Jatiwangi, Cikarang Barat. Bekasi,30,1,01.071.369.1-055.000,NULL,0,1,NULL,NULL,NULL,NULL,NULL,Ibu Yuniar,0,NULL,NULL,NULL,4680100087005,7,CIKARANG,PT. WOO IN,0
352,KGS,CV. KERSA GUNA SENTOSA,Jl. Raya Setu No. 68 Desa Telanjung RT. 02 RW. 08 Kec. Cikarang Barat,NULL,1,NULL,NULL,NULL,1,NULL,NULL,NULL,021 8263890,021 8263890,bp. cahyan,0,NULL,NULL,NULL,1560009712730,12,KARAWANG,CAHYAN,0
353,EMJ,PT. ELIZA MEGA JAYA,Jl. Tambun Rengas RT.001/008 No. 56 Cakung Timur -Jakarta Timur,30,1,NULL,NULL,NULL,1,NULL,NULL,NULL,021 46826374,021 46821484,Bp. Krisman,0,NULL,NULL,NULL,1250007220858,12,UJUNG MENTENG,PT. ELIZA MEGA JAYA,0
354,ZN,CV. ZASKIA NUR,Jl. A.R Hakim (Pertokoan KAI Blok 20) Karawang,14,0,31.368.468.0-433.000,NULL,0,1,NULL,NULL,NULL,089687636806,NULL,Bpk Teguh Arifin,0,NULL,NULL,NULL,9000007992986,12,KARAWANG,TEGUH ARIFIN,0
355,GTI,PT. GRAHA TECHNOSOFT INFORMATIKA,Jalan Panjang Raya No. 83F&G  Kompleks Graha Elok Mas  Jakarta 11510,30,1,NULL,NULL,0,1,NULL,NULL,NULL,+6221-5658566,+6221-5632078,Ibu Bertha Faustine,0,NULL,NULL,NULL,NULL,NULL,NULL,NULL,0
356,SUMEEKO,SUMEEKO INDUSTRIES Co.Ltd,No 22 Huaxi Rd,Ta fa Ind.Dist.Kaohsing City 83167,30,0,NULL,NULL,0,1,NULL,NULL,NULL,NULL,NULL,Mr. Ray Chien,0,NULL,NULL,NULL,NULL,NULL,NULL,NULL,0
357,IMAFIX,IMAFIX CO., LTD,Terrebonne, QC J6W 0A9 LEVIS ST, 1155 BRAZIL,0,0,NULL,NULL,0,1,NULL,NULL,NULL,NULL,NULL,Mr. Jakeline Dantas,0,NULL,NULL,NULL,NULL,NULL,NULL,NULL,0
358,SPD,PT. SIVA PRAMA DHANA,Jl. Raya Pilar - Sukatani KM 4, Ds.Sukaraya RT 03/03 Kec.Karang Bahagia No.9, Bekasi - Jawa Barat 17823,30,1,NULL,NULL,NULL,1,NULL,NULL,NULL,+6221-89102289,+6221-89103389,Bpk Erwin Mapawa,0,NULL,NULL,NULL,NULL,NULL,NULL,NULL,0
359,WIJAYA,CV. WIJAYA CATERING,Perum Karaba Indah Blok No. 2 Rt. 05 Rw. 09. Ds. Wadas. Kec. Telukjambe Timur Karawang 41361,0,0,NULL,NULL,0,1,NULL,NULL,NULL,0858 1020 8884/0813 1098 8118,NULL,NULL,0,NULL,NULL,NULL,1320014300009,12,KARAWANG,JOKO WIJAYA K.S.,0
360,WIENS,PT. BUNDA WIENS,JL. KAMOJING NO. 02 CIKAMPEK SELATAN,NULL,1,NULL,NULL,NULL,1,NULL,NULL,NULL,0264 838 7598,0264 317954,Bp. Sodikin,0,NULL,NULL,NULL,NULL,NULL,NULL,NULL,0
361,KM,PT. KALUNG METALINDO,Jl. Raya Cibarusah No.19 - LIPPO CIKARANG, Cikarang Selatan - Bekasi,30,1,NULL,NULL,0,1,NULL,NULL,NULL,+6221 89901521  ||  +6221 8974055 - 56,+6221 89902380,Bpk Bambang Wibisono,0,NULL,NULL,NULL,NULL,NULL,NULL,NULL,0
362,IMS,CV. INFO MEGA SARANA,Jl. Sunter Karya Selatan IV Blok A5 No. 12A Sunter Agung Tanjung Priok Jakarta Utara 14350,0,1,NULL,NULL,NULL,1,NULL,NULL,NULL,NULL,NULL,NULL,0,NULL,NULL,NULL,4281398282,1,SUNTER,CV. INFO MEGA SARANA,0
363,AIDA,PT. AIDA INDONESIA,Jl.Science Boulevard Blok A2/9 Kawasan Industri  Jababeka  V Cikarang Timur 17530,45,1,NULL,NULL,NULL,1,NULL,NULL,NULL,021 2962-6688,021 2962-6689,Ibu Ekka Kartika,0,NULL,NULL,NULL,3065970151,14,JAKARTA,PT. AIDA INDONESIA,0
364,HENS,PT. HENS MAKMUR SEJAHTERA,Taman Royal 2 , Jl. Brawijaya No. 19 Poris Plawad Indah Cipondoh Tangerang,30,1,NULL,NULL,NULL,1,NULL,NULL,NULL,021 55744315,021 55703151,Bp. Hendrik,0,NULL,NULL,NULL,6890143669,1,TANGERANG,PT. HENS MAKMUR SEJAHTERA,0
365,EIK,PT. EXCELLENT INFOTAMA KREASINDO,Jl. Candi Mendut Raya Blok C No. 328 Bekasi Timur 17111,0,1,NULL,Info@excellent.co.id,NULL,1,NULL,NULL,NULL,021 2210 2004,NULL,NULL,0,NULL,NULL,NULL,1560005852068,12,BEKASI,PT. EXCELLENT INFOTAMA KREASINDO,0
366,IS,PT. INDOSERAKO SEJAHTERA,Jl. P. jayakarta  121 No. 59 Jakarta Pusat  10730,30,1,NULL,NULL,0,1,NULL,NULL,NULL,021 6248923,021 6248922,Bp. Tjandi,0,NULL,NULL,NULL,NULL,NULL,NULL,NULL,0
367,PERDANA,CV. PERDANA CATERING,Dusun Babaton Jatimulya No. 31 Rt 01/04 Desa Sukaharja Kec. Teluk Jambe Timur - Kab Karawang,0,0,NULL,NULL,NULL,1,NULL,NULL,NULL,NULL,NULL,NULL,0,NULL,NULL,NULL,1320011264877,12,KARAWANG,CAN CAN AGUNG RAJASA,0
368,KALIKA,PT. KALIKA SULOSINDO,Ruko Grand Soepomo, Jl. Prof. Dr. Soepomo Kav. g No. 73, Kel. Menteng Dalam, Kec. Tebet, Jakarta Selatan,0,1,NULL,NULL,NULL,1,NULL,NULL,NULL,NULL,NULL,NULL,0,NULL,NULL,NULL,NULL,NULL,NULL,NULL,0
369,CM,PT. CORE MEDIATECH,Gedung CM Jl. Mataram I No. 9 Jakarta, 13150, Indonesia,0,1,NULL,NULL,NULL,1,NULL,NULL,NULL,NULL,NULL,NULL,0,NULL,NULL,NULL,NULL,NULL,NULL,NULL,0
370,DTT,DWIDAYA TOUR & TRAVEL,Ruko Plaza Menteng Blok B-20 Jl. MH Thamrin  Lippo Cikarang,NULL,1,NULL,NULL,NULL,1,NULL,NULL,NULL,021 89900901,021 89909553,Herlina,0,NULL,NULL,NULL,NULL,NULL,NULL,NULL,0
371,GTB,PT. GLOBAL TEKNINDO BERKATAMA,JL. HARAPAN VIII LOT LL-6, DESA PARUNG MULYA, KEC. CIAMPEL, KARAWANG,30,1,NULL,NULL,0,1,NULL,NULL,NULL,NULL,NULL,NULL,0,NULL,NULL,NULL,3537235685,21,ITC CEMPAKA,PT. GLOBAL TEKNINDO BERKATAMA,0
372,SUGIURA,PT. SUGIURA INDONESIA,SURYACIPTA CITY of INDUSTRY  Jl. Surya Utama Kav I-41  Ds Kutanegara  Ciampel  Karawang, Jawa Barat 41363 - Indonesia,30,1,NULL,NULL,0,1,NULL,NULL,NULL,+62267 8630420,+62267 8630430,Ibu Rika,0,NULL,NULL,NULL,665187558,4,JAKARTA,PT. SUGIURA INDONESIA,0
373,EPP,PT. EKATAMA PUTRA PERKASA,Jl. Boulevard Bukit Gading Raya No.3 ( Gd Ekatama ) , Jakarta 14240,30,1,NULL,NULL,0,1,NULL,NULL,NULL,+6221 4514678,+6221 4513537 / 4514058,Bpk Bambang Heriawan, ST,0,NULL,NULL,NULL,NULL,NULL,NULL,NULL,0
374,KMU,CV. KREASINDO MEGA UTAMA,Ruko Puri Mustika Blok D1 / 2 Bekasi Timur,NULL,1,NULL,NULL,NULL,1,NULL,NULL,NULL,021 8243 8582,NULL,Bp. BAROKAH S.H,0,NULL,NULL,NULL,NULL,NULL,NULL,NULL,0
375,MAU,PT. MITRA ASMOCO UTAMA,Jl. Griya Utama Blok A No. 40-41  Sunter Agung Podomoro - Jakarta 14350, INDONESIA,14,1,NULL,NULL,0,1,NULL,NULL,NULL,+6221 65833483,+6221 65833486,Bpk Yanifer Tandusan,0,NULL,NULL,NULL,1200009860888,12,JAKARTA,PT. MITRA ASMOCO INDONESIA,0
376,NJ,CV. NHOFAL JAYA,Jl. Raya Kalimalang Cibitung - Bekasi (Dekat Pintu Tol Cibitung),14,0,NULL,NULL,0,1,NULL,NULL,NULL,081316695758 / 08170125758,NULL,Bpk Tamam,0,NULL,NULL,NULL,8760673332,1,JAKARTA,CV. NHOFAL JAYA,0
377,FLORIST,BAMBOO FLORIST,Jl. Plaju No. 21 Jakarta 10230,NULL,1,NULL,NULL,NULL,1,NULL,NULL,NULL,021 390 9080,021 3909060,Ibu Ningsih,0,NULL,NULL,NULL,NULL,NULL,NULL,NULL,0
378,KJT,CV. KEMBAR JAYA TEHNIK,Jl. Kapling 1 No.110  Kp.Jarakosta  RT 001/003  Ds.Danau Indah - Cikarang Barat,14,0,NULL,NULL,0,1,NULL,NULL,NULL,021 89103018,+6281284806303 || +6287887737027 || +6285774673309,Bpk Sugito,0,NULL,NULL,NULL,0349039000,3,KARAWANG,DIKDIK RAMDHANI,0
379,INP,PT. INDRAGRAHA NUSAPLASINDO,KH Mohammad Mansyur No.34 - Jakarta 10140 , Indonesia,30,1,NULL,NULL,0,1,NULL,NULL,NULL,(+6221) 6324982 , 6328228 , 6325982,(+6221) 6328227 , 6320274,Bpk Hendra Dinata ( +628161347480 ),0,NULL,NULL,NULL,1053009828,1,CAPEM,PT. INDRAGRAHA NUSAPLASINDO,0
380,ISLAM,RS. ISLAM KARAWANG,Jl. Pangkal Perjuangan KM 2 KARAWANG,NULL,1,NULL,rsi_karawang@yahoo.com,NULL,1,NULL,NULL,NULL,0267 414520 - 22,0267 413277,Bpk Tedy Syafiudin, SE.,MM,0,NULL,NULL,NULL,NULL,NULL,NULL,NULL,0
381,RIVADESIGN,RIVA_DESIGN,Puri Cikarang Hijau A6 / 03 Karang Asih Cikarang Utara,NULL,1,NULL,NULL,NULL,1,NULL,NULL,NULL,021 93644637,021 29092727,Bp. Gugun,0,NULL,NULL,NULL,NULL,NULL,NULL,NULL,0
382,TMA,PT. TRININDO MITRA  ABADI,JL. Harapan Indah Raya Blok SS18, No3, Bekasi,30,1,NULL,NULL,0,1,NULL,NULL,NULL,02188866235,02188866234,Bp. Eris,0,NULL,NULL,NULL,NULL,NULL,NULL,NULL,0
383,PSP,PT. PHILLIPPE SURYA PRATAMA,Jalan Raya Prancis, Villa Taman Bandara Blok Q3/6, Dadap Kosambi, Tangerang 15211,30,1,NULL,NULL,0,1,NULL,NULL,NULL,+6221 22556661 / 62 / 63,+6221 22556660,Bpk Indra,0,NULL,NULL,NULL,1071007897,11,JAKARTA,PT. PHILLIPPE SURYA PRATAMA,0
384,RHJ,PT. RODA HAMMERINDO JAYA,Jl. Duri Raya Terusan Tol No.74 A  Duri Kepa, Jakarta Barat,30,1,NULL,NULL,0,1,NULL,NULL,NULL,+6221 5652548, 5654109, 56968187,+6221 5654671, 56972372,Bpk Hartoyo,0,NULL,NULL,NULL,NULL,NULL,NULL,NULL,0
385,RKS,PT. RODA KAWAN SEJAHTERA,Ruko MM 2100 Blok A No.17 - Kawasan Industri MM2100  Ds.Gandamekar  Kec.Cikarang Barat  Kab.Bekasi,30,1,NULL,NULL,0,1,NULL,NULL,NULL,+6221 89984232, 89984233,+6221 89984234,Bpk Andri,0,NULL,NULL,NULL,0701603605,16,CIBITUNG,PT. RODA KAWAN SEJAHTERA,0
386,TOSIDA,PT. TOSIDA BANGUN GAMA ZAHARA,Ruko Porto Spanish B 021, Deltamas,30,1,NULL,NULL,0,1,NULL,NULL,NULL,02189907308,NULL,Bpk. Ghany,0,NULL,NULL,NULL,1560011117852
,12,NULL,PT. TOSIDA BANGUN GAMA ZAHARA,0
387,RKU,CV. REVINDO KARYA UTAMA,Jln. Bougenville Raya Blok B1 No. 1A  Griya Timur Indah, Jati Mulya - Tambun Selatan, Bekasi,0,0,NULL,NULL,0,1,NULL,NULL,NULL,021 8253890,NULL,Bpk Ujangedi  ( +6282112349747 ),0,NULL,NULL,NULL,NULL,NULL,NULL,NULL,0
388,AS,PT. ANEKA STANDARD,NULL,NULL,1,NULL,NULL,NULL,1,NULL,NULL,NULL,NULL,NULL,NULL,0,NULL,NULL,NULL,NULL,NULL,NULL,NULL,0
389,BR,CV. BERTINDO,NULL,NULL,1,NULL,NULL,NULL,1,NULL,NULL,NULL,NULL,NULL,NULL,0,NULL,NULL,NULL,NULL,NULL,NULL,NULL,0
390,BUT,PT. BAHANA UNINDO TEHNIK,JL. Raya K.H Noer Ali, Inspeksi Kalimalang Kav 08-09, Tambun, Bekasi,30,1,NULL,NULL,NULL,1,NULL,NULL,NULL,021-88394725,021-88394726,Mr. Agus Sudibyo,0,NULL,NULL,NULL,0216340169,3,Bekasi,PT. BAHANA UNINDO TEKNIK,0
391,CALTESYS,PT. CALTESYS INDONESIA (X),NULL,NULL,1,NULL,NULL,NULL,1,NULL,NULL,NULL,NULL,NULL,NULL,0,NULL,NULL,NULL,NULL,NULL,NULL,NULL,0
392,GMIM,PT. GENERAL MOTORS INDONESIA MANUFACTURING,Jl. Raya Bekasi JM. 27 Pondok Ungu, Bekasi 17132,0,1,31.271.621.0-431.000,NULL,NULL,1,NULL,NULL,NULL,NULL,NULL,NULL,0,NULL,NULL,NULL,NULL,NULL,NULL,NULL,0
393,3S,PT. TIGA SAUDARA PUTRI,Pusat Perniagaan Cempaka Mas  Blok M1 / 30  -  Jakarta,30,1,NULL,NULL,0,1,NULL,NULL,NULL,+62267 8490889 / 90,+62267 8490891,Bpk Rudi Supriyadi,0,NULL,NULL,NULL,6380249055,1,GRAHA KIRANA,PT. TIGA SAUDARA PUTRI,0
394,GPM,PT. GEMILANG POWER MESINDO,KOMP. RUKO BATU CEPER BLOK U12 , Jln. Daan Mogot KM 21,30,1,NULL,NULL,NULL,1,NULL,NULL,NULL,02155735108,021 5579 8672,Bp. Ravi,0,NULL,NULL,NULL,NULL,NULL,NULL,NULL,0
395,FMT,FIRST MACHINERY TRADE CO.,Jl. Krekot Dalam Blok I / 10, Komplek Jaya Molek, Jakarta 10710,30,1,NULL,NULL,0,1,NULL,NULL,NULL,021 3459184,+6221 3858904,Bpk Slamet Harjanto,0,NULL,NULL,NULL,5890112228,1,JAKARTA,CV. FIRST MACHINERY TRADE CO.,0
396,IKT,PT. IMEDAL KARYA TEKNIK,Jl. Jampang No.34 Kp Jatimulya - Tambun, Bekasi,30,1,NULL,NULL,0,1,NULL,NULL,NULL,+6221-82608417,NULL,Bpk Cahyan,0,NULL,NULL,NULL,1560006193876,12,JAKARTA,PT. IMEDAL KARYA TEKNIK,0
397,BLJ,CV. BULUKUMBA JAYA,Jl. Arif Rahman Hakim No.28 Karawang,NULL,0,NULL,NULL,0,1,NULL,NULL,NULL,083891214466,+6281324412400,Jaya_bulukumba@yahoo.com,0,NULL,NULL,NULL,2753706810,1,KARAWANG,NASRUDI,0
398,TAHARICA,PT. TAHARICA,Jl. Radin Inten II No.62 Duren Sawit, Jakarta 13440 - INDONESIA,0,1,NULL,NULL,0,1,NULL,NULL,NULL,+6221-86906777,+6221-86906770,Ibu Selly ( +6281387428586 ),0,NULL,NULL,NULL,NULL,NULL,NULL,NULL,0
399,DSL,PT. DSL INDONESIA,KAWASAN INDUSTRI MULTI GUNA SERPONG BLOK D1/3 JL. RAYA SERPONG  SERPONG TANGERANG,30,1,NULL,NULL,NULL,1,NULL,NULL,NULL,021 5312 4669,021 5312 1907,Ibu Yunita  Meliana,0,NULL,NULL,NULL,1190098999988,12,JAKARTA,PT. DSL INDONESIA,0
400,MOSSI,PT. METAL ONE STEEL SERVICE INDONESIA,Kawasan GIIC Blok AE No.06, Nagasari, Serang Baru, Bekasi. 17330,30,1,NULL,NULL,0,1,NULL,NULL,NULL,021 50555307,021 50555310,Ibu Fitri,0,NULL,NULL,NULL,665000218,4,JAKARTA,PT. METAL ONE STEEL SERVICE INDONESIA,0
401,MAKINO,PT. MAKINO INDONESIA,Jl. Sriwijaya Kavling 5- 8 Lippo Cikarang - Cikarang Bekasi,30,1,NULL,NULL,NULL,1,NULL,NULL,NULL,02189903366,02189903367,Ibu Ika,0,NULL,NULL,NULL,3020016843,10,JAKARTA,PT. MAKINO INDONESIA,0
402,WTC,PT. WAJA TEHNIK CIKARANG,Jl. Raya Cibeber RT. 003/006 Desa Pasir Gombong Kec Cikarang Utara Bekasi,30,1,NULL,NULL,NULL,1,NULL,NULL,NULL,021 898322376,021 89834112,Bp. Fatah,0,NULL,NULL,NULL,1560003081009,12,CIKARANG,PT. WAJA TEKNIK CIKARANG,0
403,FTI,PT. FUJI TECHNICA INDONESIA,Jl. Maligi Raya Lot A-6 & 7, Kawasan Industri KIIC Sukaluyu, Teluk Jambe Timur, Karawang Jawa Barat 41361,30,1,01.071.093.7.055.000,NULL,1,1,NULL,NULL,NULL,NULL,NULL,NULL,0,NULL,NULL,NULL,NULL,NULL,NULL,NULL,0
404,RAE,PT. RIZKY ANUGERAH ENGINEERING,Jl. Swadaya 2 0211 No. 31 Cimanggis - Depok  16953,30,1,NULL,NULL,NULL,1,NULL,NULL,NULL,021 8775 6737,021 8775 0222,Bpk Ardi Wijaya,0,NULL,NULL,NULL,042201000184301,5,JAKARTA,PT. RIZKY ANUGERAH ENGINEERING,0
405,forklift,PT. PROTON LIFTINDO,JL. Raya cikarang,30,1,NULL,NULL,NULL,1,NULL,NULL,NULL,08128257576,NULL,Bp. Sigit,0,NULL,NULL,NULL,NULL,NULL,NULL,NULL,0
406,accu,CV. BULUKUMBA JAYA,Jl. AR. Rahman Hakim ( Niaga ) no. 32 Karawang Barat,10,0,NULL,NULL,NULL,1,NULL,NULL,NULL,0267 9075366,083891214466,Bp. Nasrudi,0,NULL,NULL,NULL,2753706810,1,KARAWANG,NASRUDI,0
407,EKAMANT,PT. EKAMANT INDONESIA,Jl. Rawa Sumur BPSP Blok K3-4 Kawasan Industri Pulogadung 13930  JAKARTA,30,1,NULL,NULL,NULL,1,NULL,NULL,NULL,021 46826220,021 4682613,Bp. Edi / Bp Budi,0,NULL,NULL,NULL,2413004039,1,KELAPA GADING,PT. EKAMANT INDONESIA,0
408,DLM,PT. DUTA LASERINDO METAL,Delta Silicon Industrial Park Lippo Cikarang, Lemah Abang,14,1,NULL,NULL,0,1,NULL,NULL,NULL,021-89907947,021-89907949,Pa Ronald,0,NULL,NULL,NULL,NULL,NULL,NULL,NULL,0
409,GQI,PT. GLOBAL QUALITY INDONESIA,Kompleks Kopo Mas Regency Blok N-7C-Bandung,30,1,NULL,NULL,NULL,1,NULL,NULL,NULL,022-5436533,NULL,Ibu. Fransisca,0,NULL,NULL,NULL,0369256294,3,JAKARTA,PT. GLOBAL QUALITY INDONESIA,0
410,DPK,PT. DHARMAMULIA PRIMA KARYA,Jl. Kaliurang Km. 6 Pandega Sakti No. 6 Yogyakarta,0,1,NULL,NULL,NULL,1,NULL,NULL,NULL,NULL,NULL,NULL,0,NULL,NULL,NULL,0039235610,3,YOGYAKARTA,PT. DHARMAMULIA PRIMA KARYA,0
411,ANTAVAYA,PT. VAYATOUR / CONTAC CENTER 4,Jl. Batu Tulis Raya No.38  Jakarta,NULL,1,NULL,NULL,NULL,1,NULL,NULL,NULL,021 3800202,021 3455252,Ibu Linda,0,NULL,NULL,NULL,010170011002343,13,JAKARTA,PT. VAYATOUR,0
412,FE,PT. FLOWMINE ENGINEERING,Jl. Raya Curug KM 3 No.26  Kadu - Tangerang,30,1,NULL,flowmine@ymail.com || sarwo_sarwoko@yahoo.com,NULL,1,NULL,NULL,NULL,+6221 - 5986404 || +62816775619,+6221 - 54215218,Bpk Sarwoko,0,NULL,NULL,NULL,8015034919,1,TANGERANG,PT. FLOWMINE ENGINEERING,0
413,PLN,PT. PLN (Persero),Rayon Prima Karawang,0,0,NULL,NULL,NULL,1,NULL,NULL,NULL,NULL,NULL,NULL,0,NULL,NULL,NULL,NULL,NULL,NULL,NULL,0
414,BLIM,PT. BERSAMA LIM MAJU,JL. Jababeka VII G, Blok R No. 1E, Cikarang,30,1,NULL,NULL,0,1,NULL,NULL,NULL,021-8935235,021-8936192,Bp. Aris,0,NULL,NULL,NULL,1071250155,6,GLODOK,PT. BERSAMA LIM MAJU,0
415,SAE,PT. SERVITAMA ERA TOOLSINDO,Jl Pulo Sidik Blok R No. 29 Kawasan Industri Pulogading,30,1,NULL,NULL,NULL,1,NULL,NULL,NULL,021 468 34111/02146834112,021 46834113,Bp. Kelik,0,NULL,NULL,NULL,0012943339,3,RAWAMANGUN,PT. SERVITAMA ERA TOOLSINDO,0
416,SUNYUU,PT. SUNYUU AUTOMATIC INDONESIA,JL. Jababeka II blok OO 2A, Cikarang,30,1,NULL,NULL,0,1,NULL,NULL,NULL,021-92957073,021-89911013,Bpk. Rocky,0,NULL,NULL,NULL,1560010506964,12,BEKASI,PT. SUNYUU AUTOMATIC INDONESIA,0
417,MANDIRI,PT. BANK MANDIRI PERSERO TBK. CABANG KARAWANG,Jl. Jendral Ahmad Yani No. 4, Karawang Wetan, Karawang,NULL,1,01.061.173.9-093.000,NULL,1,0,NULL,NULL,NULL,NULL,NULL,NULL,0,NULL,NULL,0,NULL,NULL,NULL,NULL,0
418,TJP,PT. TRISAHABAT JAYA PRIMA,Jl. Pramuka Raya No. 3 SEPANJANG JAYA  RAWA LUMBU BEKASI  17114,30,1,NULL,NULL,NULL,1,NULL,NULL,NULL,021 8216482,021 82415665,Bp. Fransiskus  S.,0,NULL,NULL,NULL,NULL,NULL,NULL,NULL,0
419,PSM,PT. PRESISIS SUKSES MANDIRI,JL. Industri Selatan XI Blok EE No.12D, Jababeka,30,1,NULL,NULL,0,1,NULL,NULL,NULL,021-89842835,021-89842833,Bpk. Agung,0,NULL,NULL,NULL,NULL,NULL,NULL,NULL,0
420,MCC,PT. METAPLAS CITRA CEMERLANG,Kawasan industri Hyundai, JL. Palem II Blok DS 11A, Lippo Cikarang,30,1,NULL,NULL,0,1,NULL,NULL,NULL,021-8974365,021-8974367,Bpk. Bayu,0,NULL,NULL,NULL,NULL,NULL,NULL,NULL,0
421,EL,PT. ECOSINDO LABORANUSA,Bekasi,7,1,NULL,NULL,0,1,NULL,NULL,NULL,+6221 82407113  ||  +6285759307238,NULL,Ibu Wanda,0,NULL,NULL,NULL,0137095679,3,BEKASI,PT. ECOSINDO LABORANUSA,0
422,NSI,PT. NUSANTARA SECOM INFOTECH,Menara Jamsostek 17th Floor   Jl. Jend Gatot Subroto No.38  Jakarta 12710 - Indonesia,30,1,NULL,NULL,0,1,NULL,NULL,NULL,021-2501248,021-2601266,Bpk Ifan Setya Efendi,0,NULL,NULL,NULL,NULL,NULL,NULL,NULL,0
423,DM,CV. Dinamika Manunggal,Jl Pangkal Perjuangan Km. 1 Karangpawitan - Karawang 41315,14,0,NULL,NULL,NULL,1,NULL,NULL,NULL,0267 405642,0267 405643,NULL,0,NULL,NULL,NULL,NULL,NULL,NULL,NULL,0
424,ASMG,PT. ANUGRAH SUKSES MAKMUR GEMILANG,Komplek Pergudangan BIZ PARK CAKUNG Blok GS 7 No. 66 Jakarta Timur,14,1,NULL,NULL,NULL,1,NULL,NULL,NULL,0267 415815,NULL,Bpk Jaenal,0,NULL,NULL,NULL,6840215758,1,KEMAYORAN,PT. ANUGRAH SUKSES MAKMUR GEMILANG,0
425,YONGSHIN,PT. YONG SHIN INDONESIA,JL. Jababeka XVII B Blok U 18A, Kawasan Industri Jababeka - Bekasi 17550,30,1,NULL,NULL,0,1,NULL,NULL,NULL,02189109616,+6221 89109617,Bp. Wayan,0,NULL,NULL,NULL,024010406909,18,KELAPA GADING,PT. YONG SHIN INDONESIA,0
426,TOOLGIKEN,PT. TOOL GIKEN INDUSTRY,JL. Kenari Raya Blok A No 5, Delta Comercial Park, Lippo Cikarang,30,1,NULL,NULL,0,1,NULL,NULL,NULL,021- 29612134,NULL,Bp. yosep,0,NULL,NULL,NULL,2246029850,2,CIKARANG,PT. TOOL GIKEN INDUSTRY,0
427,JOBSTREET,PT. JOBSTREET INDONESIA,Wisma Bumiputera, 5th floor, Jl. Jendral Sudirman Kav. 75 - Jakarta 12910,0,1,NULL,ads-id@jobstreet.com,NULL,1,NULL,NULL,NULL,021 5700151,021 5700152,NULL,0,NULL,NULL,NULL,7340360031,1,JAKARTA,PT. JOBSTREET INDONESIA,0
428,WPHotel,WHIZ Prime Hotel,Jalan Cibarusah Raya  South Cikarang - Bekasi  West Java  17550, Indonesia,7,0,NULL,acct.cikarang@whizprime.com,0,1,NULL,NULL,NULL,+6221 29619090,+6221 29619191,Mrs Aryandini  ( +6282116677777 ),0,NULL,NULL,NULL,NULL,NULL,NULL,NULL,0
429,CAB,PT. CITRA ASRI BUANA,Jl. Suroto Kunto No. 217 - Karawang,0,1,NULL,NULL,0,1,NULL,NULL,NULL,NULL,NULL,Bpk M Surya Darmawan,0,NULL,NULL,NULL,NULL,NULL,NULL,NULL,0
430,AI,PT. ASTRA INTERNASIONAL Tbk,Toyota - Karawang Branch   Jl. Surotokunto 80, Karawang 41313,0,0,NULL,NULL,0,1,NULL,NULL,NULL,+62267 412000,+62267 402570,Bpk Martinus Wahyudi,0,NULL,NULL,NULL,0933023033,1,KARAWANG,PT. ASTRA INTERNATIONAL,0
431,AMTEK,PT. ANUGERAH MANDIRI TEKNIK,JL. Jababeka XVII B Blok U No 22E, Jababeka I,30,0,NULL,NULL,0,1,NULL,NULL,NULL,021-29566063,021-89970172,Bpk. Rismanto,0,NULL,NULL,NULL,NULL,NULL,NULL,NULL,0
432,SJT,PT. SUMBERTAMA JAYA TEKNIK,Jl. MH Thamrin Ruko Roxi Blok C No. 11, Lippo Cikarang Bekasi 17550,30,1,NULL,sales@sumbertama.com,0,1,NULL,NULL,NULL,(0267) 415815,(0267) 416718,Reny Marlina,0,NULL,NULL,NULL,5220304398,1,CIKARANG,PT. SUMBERTAMA JAYA TEKNIK,0
433,HANUSA,PT. HANUSA,Kawasan Industri Greenland Blok AD No. 5, Deltamas,0,0,NULL,NULL,NULL,1,NULL,NULL,NULL,021-89973264,NULL,Bp. Kurnia / Ibu Jarni,0,NULL,NULL,NULL,NULL,NULL,NULL,NULL,0
434,MJT,PT. MITRA JAYA TOOLSINDO,Ruko Permata Hijau Jl. Azalea No.16 Cikarang Kawasan Delta Silicon - Lembah Hijau, Lippo Cikarang Bekasi 17550,30,1,NULL,NULL,0,1,NULL,NULL,NULL,+6221 8990580910 dan +6221 89903397,+6221 89903397,NULL,0,NULL,NULL,NULL,1560020998888,12,JABABEKA,PT. MITRA JAYA TOOLSINDO,0
435,ZACO,CV. ZACOTECH MITRA USAHA,Jl Teratai II, B4 No. 1 Cikarang Utara Kab. Bekasi,30,1,NULL,zacotech@gmail.com,NULL,1,NULL,NULL,NULL,021 29482765,021 29482765,BPK SUPRIYANTO,0,NULL,NULL,NULL,1560010046417,12,JABABEKA,CV. ZACOTECH MITRA USAHA,0
436,ESSAR,ESSAR STEEL,Jl. Raya Klari Kp. Suka Makmur RT 09 / RW 04. Desa Anggadita,0,1,NULL,sulistyowatianik63@yahoo.co.id,NULL,1,NULL,NULL,NULL,082113394937,0267 8642979,Ibu Anik,0,NULL,NULL,NULL,NULL,NULL,NULL,NULL,0
437,PKMI,PT. PK MANUFACTURING INDONESIA,Jl. Harapan Raya Lot JJ-2B Kawasan Industri KIIC Sirnabaya, Teluk Jambe Timur, Karawang Jawa Barat 41361,30,1,31.362.422.3-431.000,NULL,1,1,NULL,NULL,NULL,NULL,NULL,NULL,0,NULL,NULL,0,NULL,NULL,NULL,NULL,0
438,SSM - Body Repair,CV. SINAR SURYA MOTOR II,Jl. Badami  Kampung Cisalak  Ds Margakarya - Karawang Barat 41361,30,1,NULL,sinarsurya2motor@yahoo.co.id,NULL,1,NULL,NULL,NULL,+6281287256288,NULL,Bpk Yusmana,0,NULL,NULL,NULL,1093032199,1,KARAWANG,CV. SINAR SURYA MOTOR,0
439,MM,CV MAJU MAPAN,Perum Grand Cikarang City  Blok H2 No.18  Cikarang Utara - Bekasi,0,0,NULL,syamsul75rizal@gmail.com,0,1,NULL,NULL,NULL,+6281310204565  |  +6281317685644,NULL,Bpk Sigit,0,NULL,NULL,NULL,7110840017,1,CIKARANG,SYAMSUL RIZAL,0
440,Informa,PT. HOME CENTER INDONESIA,Jl. Arteri Galuh Mas Blok A1 - Karawang Barat,0,0,NULL,informa.karawang@homecenter.co.id,0,1,NULL,NULL,NULL,+62267 8638333,NULL,Mr Karnawan Galuh,0,NULL,NULL,NULL,NULL,NULL,NULL,NULL,0
441,CTMI,PT. CAKRAWALA TEKNIK MANDIRI INDONESIA,delta Comercial Park 1, Blok B15 kawasan Industri Delta Silicon 6, Lippo Cikarang,30,1,NULL,NULL,0,1,NULL,NULL,NULL,021-28085086,021-28085089,Bpk. Mesah,0,NULL,NULL,NULL,1560006112355,12,BEKASI,PT. CAKRAWALA TEKNIK MANDIRI INDONESIA,0
442,UC Seragam,Umbul Collection,Jl. Gugus Depan H 183, Jembatan 1  Perum Bumi Bekasi Baru - Rawa Lumbu, Bekasi,0,0,NULL,NULL,0,1,NULL,NULL,NULL,+6281806278896 , +6285310022259,NULL,Bpk Suharno,0,NULL,NULL,NULL,0662348781,1,JAKARTA,SUHARNO,0
443,OAE,PT. OAE MANUFACTURING INDONESIA,JL. raya cikarang cibarusah, mega regency, blok A1 no.8,30,1,NULL,NULL,0,1,NULL,NULL,NULL,021-29281909,NULL,Bpk. Surono,0,NULL,NULL,NULL,1223678110,16,CIKARANG,PT. OAE MANUFAKTUR INDONESIA,0
444,EM,PT. ELEKTRIKA MULTIKATAMA,Komplek Istana Mekar Wangi Ruko Taman Mekar Agung No. 45 Bandung 40237,14,1,NULL,admin@elmika.co.id / elmikamk@gmail.com,1,1,NULL,NULL,NULL,022 5234059,022 88885424,Bpk. Rinto,0,NULL,NULL,NULL,4533030681,1,BANDUNG,PT. ELEKTRIKA MULTIKATAMA,0
445,NARAJS,PT. NARAJS INTI GANDA,Jl Gaharu 1 Blok F02 No. 010S Delta Silicon 2 Lippo Cikarang - Bekasi,30,1,NULL,agus.pt.njs@gmail.com,1,1,NULL,NULL,NULL,021 8990 4080,021 8990 4081,Bpk. Agus Nurjaman,0,NULL,NULL,NULL,1560014021507,12,CIKARANG,PT. NARAJS INTI GANDA,0
446,AKUSARA,CV. AKUSARA JAYA,Jl Basuki Rahmat Gg. Wortel No. 7 Kab. Purwakarta,14,0,NULL,akusarajaya@yahoo.com,0,1,NULL,NULL,NULL,(0264) 209641,(0264) 209641,Bpk Adi Gunawan,0,NULL,NULL,NULL,9000031051403,12,PURWAKARTA,ADI GUNAWAN,0
447,FTI,FORMING TECHNOLOGIES INCORPORATED,3370 South Service Road  Burlington, ON, L7N 3M6 - CANADA,0,0,NULL,dmarinac@forming.com,0,1,NULL,NULL,NULL,905-340-2997 x235,905-340-0377,Dan Marinac,0,NULL,NULL,NULL,NULL,NULL,NULL,NULL,0
448,HPM,PT. HONDA PROSPECT MOTOR,Jl. Gaya Motor 1 Sunter II Sungai Bamboo Tanjung Priok - Jakarata Utara,NULL,1,01.000.240.0-092.000,NULL,1,1,NULL,NULL,NULL,NULL,NULL,NULL,0,NULL,NULL,NULL,NULL,NULL,NULL,NULL,0
449,Jasa,JASA TEHNIK,Jln. Asia Pasifik Fiber   Kiara Payung, Klari - Karawang,14,0,NULL,NULL,0,1,NULL,NULL,NULL,+628121815018  ||  +6287741539388,NULL,Bpk Saono,0,NULL,NULL,NULL,0001656223,3,BEKASI,SAONO,0
450,SSD,PT. SURYA SARANA DINAMIKA,Delta Commercial Park 1 Blok A No. 6 Jl. Kenari Raya, Lippo Cikarang, Bekasi,14,1,NULL,bowo@suryasarana.com,NULL,1,NULL,NULL,NULL,(021) 8991 1097,(021)8991 1098,Bpk Rio Wijaya,0,NULL,NULL,NULL,5000405550,1,JAKARTA,PT. SURYA SARANA DINAMIKA,0
451,MEIJI,PT. MEIJI TRANSINDO,JL. MH Thamrin Ruko Roxy, Blok B-22, Lippo Cikarang.,30,1,NULL,NULL,0,1,NULL,NULL,NULL,021-8990-1651,021-8990-1654,Bpk. Delvin,0,NULL,NULL,NULL,1200088819888,12,JAKARTA,PT. MEIJI TRANSINDO,0
452,ARES,PT. Arestech Mitrasukses Sejahtera,Jl Kemal Raya Outering Road, Cengkareng Jakarta Barat 11730,30,1,NULL,zhenlenny@gmail.com,0,1,NULL,NULL,NULL,021 - 37372968,021 - 56944853,Ibu Lenny,0,NULL,NULL,NULL,1180006632433,12,CENGKARENG,PT. ARESTECH MITRASUKSES SEJAHTERA,0
454,EMI,PT. EXEDY MANUFACTURING INDONESIA,JL. PERMATA V LOT EE-3, KIIC,30,1,NULL,NULL,NULL,1,NULL,NULL,NULL,021-89114666,021-89114568,Ms. indah,0,NULL,NULL,NULL,665062885,4,KARAWANG,PT. EXEDY MANUFACTURING INDONESIA,0
455,MEGATAMA,PT. MEGATAMA ELECTRIC,Komp. Ruko Graha Bekasi Timur No. 2 Jl. Raya Pondok Timur, Pengasinan, Bekasi Timur,30,1,NULL,NULL,0,1,NULL,NULL,NULL,021-82424609, 021-29085278,021-82424580,Ibu Megawati,0,NULL,NULL,NULL,NULL,NULL,NULL,NULL,0
456,NIJES,PT. NIJES BAYU LESTARI,Jl. KH. Agus Salim 15 Bekasi,30,1,NULL,nijes_nbl@yahoo.com,0,1,NULL,NULL,NULL,021-8802698,021-88346768,Bpk Elwin,0,NULL,NULL,NULL,701293282,16,PM Sawah Besar,PT. Nijes Bayu Lestari,0
457,SP Oil,PT. SEJAHTERA PRADIPTA,Perkantoran Alam Sutera, Sutera Niaga III, Blok C/16, Serpong - Tangerang 15325,30,1,NULL,sejahtera_pta@cbn.net.id,0,1,NULL,NULL,NULL,+6221 53120556 , +6221 32473288,+6221 53121574,Bpk Ariyanto Prasetio,0,NULL,NULL,NULL,6040311678,1,ALAM SUTERA,PT. SEJAHTERA PRADIPTA,0
458,IMG Gas,Toko Irama Motor Gas,Jl. Pangkal Perjuangan By Pass - Karawang,0,0,NULL,NULL,0,1,NULL,NULL,NULL,+62267 407376,NULL,NULL,0,NULL,NULL,NULL,NULL,NULL,NULL,NULL,0
459,SUN,CV. SUNJAYA TEKNIK,Plaza Jayakarta Lantai 1 No. 2075 Jl. Labu Mangga Besar Jakarta Barat,30,1,NULL,sunjaya_teknik@yahoo.co.id,0,1,NULL,NULL,NULL,(021) 62309503,(021) 62307160,Bpk. Hendra,0,NULL,NULL,NULL,NULL,NULL,NULL,NULL,0
460,SBHotel,SWISS-BELINN Karawang,Jl. Jendral Ahmad Yani Kav 29, Karawang 41315  West Java, Indonesia,0,0,NULL,karawang@swiss-belhotel.com,0,1,NULL,NULL,NULL,+62267 8641000,+62267 864100,Mr M Fadly Basalamah,0,NULL,NULL,NULL,1093060800,1,KARAWANG,PT. MITRA KARAWANG SEJAHTERA,0
461,SR Forklift,SUMBER REZEKI,Kawasan Segitiga Emas Jababeka  Jl.Raya Lemah Abang  Blok B No.5  Cikarang - Bekasi,30,1,NULL,srforklift_jababeka@yahoo.com,0,1,NULL,NULL,NULL,+6221 89840084,+6221 89842144,Ibu Sari,0,NULL,NULL,NULL,1675001238,15,ENGGANO,CV. SUMBER REZEKI,0
